title,views,url,id,dateCreated
How do I rate a page and send feedback?,164,https://support.procore.com/faq/how-do-i-rate-a-page-and-send-feedback,3291,"Tue, 16 Jun 2015 07:45:50 GMT"
(Beta) What are custom workflows and which Procore tools support them?,164,https://support.procore.com/faq/what-are-custom-workflows-and-which-procore-tools-support-them,136339,"Tue, 20 Jul 2021 20:22:28 GMT"
When does the Tasks tool send email notifications?,164,https://support.procore.com/faq/when-does-the-tasks-tool-send-email-notifications,155457,"Fri, 18 Mar 2022 17:48:34 GMT"
How do I add additional contacts to a vendor profile in Portfolio Financials?,159,https://support.procore.com/faq/how-do-i-add-additional-contacts-to-a-vendor-profile-in-portfolio-financials,94385,"Thu, 27 Aug 2020 01:02:40 GMT"
How often can I sync data between Sage 100 Contractor and Procore?,159,https://support.procore.com/faq/how-often-can-i-sync-data-between-sage-100-contractor-and-procore,41273,"Thu, 08 Nov 2018 22:23:13 GMT"
Why are recent changes to my Sage database missing in Procore?,158,https://support.procore.com/faq/why-are-recent-changes-to-my-sage-database-missing-in-procore,1331,"Wed, 18 Feb 2015 19:43:22 GMT"
What is OxBlue and how does it integrate with Procore?,158,https://support.procore.com/faq/what-is-oxblue-and-how-does-it-integrate-with-procore,10792,"Mon, 19 Sep 2016 17:01:44 GMT"
Forgot Email,151,https://support.procore.com/faq/trouble-logging-in-to-procore/forgot-email,39967,"Thu, 11 Oct 2018 20:56:52 GMT"
How do I give users access to a Training Center?,148,https://support.procore.com/faq/how-do-i-give-users-access-to-a-training-center,16199,"Tue, 11 Apr 2017 07:39:29 GMT"
"Which fields in the Change Events tool can be configured as required, optional, or hidden?",147,https://support.procore.com/faq/which-fields-in-the-change-events-tool-can-be-configured-as-required-optional-or-hidden,154940,"Mon, 14 Mar 2022 19:10:06 GMT"
Can I create a list of overdue Prime Contract Change Orders (PCCOs)?,146,https://support.procore.com/faq/can-i-create-a-list-of-overdue-pccos,77180,"Wed, 08 Apr 2020 23:17:38 GMT"
Can I edit my change order or invoice in Portfolio Financials?,146,https://support.procore.com/faq/can-i-edit-my-change-order-or-invoice-in-portfolio-financials,95016,"Tue, 01 Sep 2020 21:29:30 GMT"
Are granular permissions available in Portfolio Financials and Capital Planning?,141,https://support.procore.com/faq/are-granular-permissions-available-in-portfolio-financials-and-capital-planning,113542,"Fri, 08 Jan 2021 19:41:25 GMT"
Can multiple users work on estimates and takeoffs at the same time in the Estimating tool?,141,https://support.procore.com/faq/can-multiple-users-work-on-estimates-and-takeoffs-at-the-same-time-in-the-estimating-tool,158877,"Mon, 25 Apr 2022 18:23:57 GMT"
"When updating the Work Log section, why can't I see any names in my resource list?",141,https://support.procore.com/faq/when-updating-the-work-log-section-why-cant-i-see-any-names-in-my-resource-list,1560,"Tue, 24 Feb 2015 19:40:14 GMT"
What is the Bid Room in Portfolio Financials?,141,https://support.procore.com/faq/what-is-the-bid-room-in-portfolio-financials,86470,"Tue, 16 Jun 2020 19:42:01 GMT"
What is the difference between a default and custom segment in Procore's WBS?,139,https://support.procore.com/faq/what-is-the-difference-between-a-default-and-custom-segment-in-procores-wbs,126941,"Mon, 03 May 2021 19:46:55 GMT"
What happens to projects when I change the segment order of my company's budget code structure in WBS?,139,https://support.procore.com/faq/what-happens-to-projects-when-i-change-the-segment-order-of-my-companys-budget-code-structure-in-wbs,131157,"Fri, 11 Jun 2021 22:58:12 GMT"
Why am I not receiving emails from Portfolio Financials and Capital Planning?,139,https://support.procore.com/faq/why-am-i-not-receiving-emails-from-portfolio-financials,94025,"Tue, 25 Aug 2020 18:49:19 GMT"
Why is it valuable to have 'Procore' as an endorsable skill on my LinkedIn profile?,138,https://support.procore.com/faq/why-is-it-valuable-to-have-procore-as-an-endorsable-skill-on-my-linkedin-profile,4808,"Tue, 01 Dec 2015 10:27:44 GMT"
What is the default behavior for playing certification videos on certain browsers?,138,https://support.procore.com/faq/what-is-the-default-behavior-for-playing-certificiation-videos-on-certain-browsers,44107,"Thu, 03 Jan 2019 17:50:43 GMT"
(DRAFT) Are there any character limitations when exporting Procore data to an integrated ERP system?,137,https://support.procore.com/faq/are-there-any-character-limitations-when-exporting-procore-data-to-an-integrated-erp-system,62901,"Mon, 18 Nov 2019 16:26:35 GMT"
What is the Project Team in Portfolio Financials and what are the varying permission levels?,136,https://support.procore.com/faq/what-is-the-project-team-in-portfolio-financials-and-what-are-the-varying-permission-levels,92642,"Sat, 08 Aug 2020 00:54:48 GMT"
Why should I enable the Direct Costs tool on my project?,136,https://support.procore.com/faq/why-should-i-enable-the-direct-costs-tool-on-my-project,5685,"Sat, 13 Feb 2016 02:41:55 GMT"
What do bidders see when they are in the Bid Room?,136,https://support.procore.com/faq/what-do-bidders-see-when-they-are-in-the-bid-room,86750,"Fri, 19 Jun 2020 23:50:56 GMT"
Does the hh2 synchronization process for Sage 100 Contractor require a Terminal Server?,135,https://support.procore.com/faq/does-the-hh2-synchronization-process-for-sage-100-contractor-require-a-terminal-server,41237,"Thu, 08 Nov 2018 21:29:53 GMT"
Why am I not seeing all of my viewpoints in the viewpoints import tool?,134,https://support.procore.com/faq/why-am-i-not-seeing-all-of-my-viewpoints-in-the-viewpoints-inport-tool,39437,"Fri, 28 Sep 2018 23:23:10 GMT"
Where are some of my Bluebeam markups in Procore's attachment viewer?,133,https://support.procore.com/faq/where-are-some-of-my-bluebeam-markups-in-procores-attachment-viewer,25086,"Thu, 12 Oct 2017 18:23:05 GMT"
(Internal) Procore Construction Network FAQs,132,https://support.procore.com/faq/internal-procore-construction-network-faqs,137995,"Thu, 12 Aug 2021 14:41:48 GMT"
How can I add cost codes to a project synced with Yardi Voyager®,132,https://support.procore.com/faq/how-can-i-add-cost-codes-to-a-project-synced-with-yardi,156567,"Fri, 01 Apr 2022 22:21:50 GMT"
"If a user doesn’t have permissions to view a specific correspondence type, can they see that correspondence type in their Project Overview dashboard?",129,https://support.procore.com/faq/if-a-user-does-not-have-permission-to-view-a-specific-correspondence-type-can-they-see-that-correspondence-type-in-their-project-overview-dashboard,77067,"Wed, 08 Apr 2020 04:27:49 GMT"
Can I customize the project type options in Portfolio Financials and Capital Planning?,127,https://support.procore.com/faq/can-i-customize-the-project-type-options-in-portfolio-financials-and-capital-planning,86465,"Tue, 16 Jun 2020 19:12:54 GMT"
What is the 'Adjustments' section on a bid form in the Bid Room?,127,https://support.procore.com/faq/what-is-the-adjustments-section-on-a-bid-form-in-the-bid-room,86607,"Thu, 18 Jun 2020 18:16:29 GMT"
How can I handle CM fees in Portfolio Financials?,127,https://support.procore.com/faq/how-can-i-handle-cm-fees-in-portfolio-financials,90997,"Wed, 22 Jul 2020 22:48:46 GMT"
How do Cash Flow Forecasts and Capital Plans interact in Portfolio Financials and Capital Planning?,127,https://support.procore.com/faq/how-do-cash-flow-forecasts-and-capital-plans-interact-in-portfolio-financials-and-capital-planning,100899,"Tue, 29 Sep 2020 03:37:58 GMT"
When does an action plan shift to 'Edit' or 'View' mode?,126,https://support.procore.com/faq/when-does-an-action-plan-shift-to-edit-or-view-mode,114379,"Fri, 15 Jan 2021 21:29:14 GMT"
Why do some of my budget line items only have Unit of Measure (UOM) values?,125,https://support.procore.com/faq/why-do-some-of-my-budget-line-items-only-have-uom-values%3F,32003,"Thu, 05 Apr 2018 20:30:37 GMT"
How do I backfill an invoice from Yardi to Portfolio Financials?,124,https://support.procore.com/faq/how-do-i-backfill-an-invoice-from-yardi-to-portfolio-financials,112791,"Fri, 18 Dec 2020 22:13:27 GMT"
How will configured fieldsets affect my existing projects?,123,https://support.procore.com/faq/how-will-configured-fieldsets-affect-my-existing-projects,46465,"Thu, 07 Feb 2019 23:33:05 GMT"
Why and how do I create a custom budget code description for Procore's Project Financials tools?,123,https://support.procore.com/faq/why-and-how-do-i-create-a-custom-budget-code-description-for-procores-project-financials-tools,158714,"Thu, 21 Apr 2022 22:50:54 GMT"
What is the 'Send to Accounts Payable' feature in Portfolio Financials?,119,https://support.procore.com/faq/what-is-the-send-to-accounts-payable-feature-in-portfolio-financials,97171,"Fri, 11 Sep 2020 23:13:46 GMT"
How can I manually add a bid in Portfolio Financials?,118,https://support.procore.com/faq/how-can-i-manually-add-a-bid-in-portfolio-financials,86752,"Sat, 20 Jun 2020 00:01:52 GMT"
What is Ei Dynamics and how does it integrate with Procore?,118,https://support.procore.com/integrations/ei-dynamics/faq/what-is-ei-dynamics-and-how-does-it-integrate-with-procore,12535,"Tue, 20 Dec 2016 16:45:09 GMT"
What are the default fieldset configurations for Procore's 'Letters of Intent' template correspondence type?,118,https://support.procore.com/faq/what-are-the-default-fieldset-configurations-for-procores-letters-of-intent-template-correspondence-type,146639,"Wed, 01 Dec 2021 02:19:50 GMT"
How can I add custom Cost Tracker templates in Portfolio Financials?,114,https://support.procore.com/faq/how-can-i-add-custom-cost-tracker-templates-in-portfolio-financials,87383,"Fri, 26 Jun 2020 18:30:34 GMT"
What should I know about invoicing in Portfolio Financials?,109,https://support.procore.com/faq/what-should-i-know-about-invoicing-in-portfolio-financials,97157,"Fri, 11 Sep 2020 22:12:24 GMT"
When will I receive emails about the project I'm bidding on in Portfolio Financials?,109,https://support.procore.com/faq/when-will-i-receive-emails-about-the-project-i-am-bidding-on-in-portfolio-financials,87038,"Wed, 24 Jun 2020 01:10:47 GMT"
What is an downstream collaborator?,108,https://support.procore.com/faq/what-is-a-downstream-collaborator,148122,"Fri, 17 Dec 2021 16:32:13 GMT"
What should I know about bidding in Portfolio Financials?,102,https://support.procore.com/faq/what-should-i-know-about-bidding-in-portfolio-financials,86736,"Fri, 19 Jun 2020 19:03:30 GMT"
What is an upstream collaborator?,102,https://support.procore.com/faq/what-is-an-upstream-collaborator,148119,"Fri, 17 Dec 2021 16:30:10 GMT"
Why can't I see the Accept/Reject options in the ERP Integrations tool?,98,https://support.procore.com/faq/why-cant-i-see-the-accept-reject-options-in-the-erp-integrations-tool,50423,"Thu, 02 May 2019 18:22:45 GMT"
What are the default fieldset configurations for Procore's 'Addendum' template correspondence type?,96,https://support.procore.com/faq/what-are-the-default-fieldset-configurations-for-procores-addendum-template-correspondence-type,146609,"Wed, 01 Dec 2021 01:28:22 GMT"
(DRAFT) What is the difference between a budget code and a task code?,96,https://support.procore.com/faq/what-is-the-difference-between-a-budget-code-and-a-task-code,156406,"Tue, 29 Mar 2022 21:21:25 GMT"
How are templates created in Portfolio Financials?,95,https://support.procore.com/faq/how-are-templates-created-in-portfolio-financials,136358,"Tue, 20 Jul 2021 23:15:59 GMT"
What is the Workforce Planning Beta Program?,95,https://support.procore.com/faq/what-is-the-workforce-planning-beta-program,164453,"Tue, 12 Jul 2022 21:00:34 GMT"
What does 'Hide Bidding Info' mean for someone on the Bid Room Team?,95,https://support.procore.com/faq/what-does-hide-bidding-info-mean-for-someone-on-the-bid-room-team,93745,"Fri, 21 Aug 2020 22:23:36 GMT"
Can I include deducts in my bid submission in the Bid Room?,94,https://support.procore.com/faq/can-i-include-deducts-in-my-bid-submission-in-the-bid-room,87034,"Wed, 24 Jun 2020 00:49:56 GMT"
What is phishing?,94,https://support.procore.com/faq/what-is-phishing,56617,"Thu, 22 Aug 2019 22:15:48 GMT"
What are the default fieldset configurations for Procore's 'Lessons Learned' template correspondence type?,91,https://support.procore.com/faq/what-are-the-default-fieldset-configurations-for-procores-lessons-learned-template-correspondence-type,146634,"Wed, 01 Dec 2021 02:13:29 GMT"
How can I set up a tenant construction chargeback in the Cost Tracker?,91,https://support.procore.com/faq/how-can-i-set-up-a-tenant-construction-chargeback-in-the-cost-tracker,90890,"Wed, 22 Jul 2020 00:53:58 GMT"
Why is it recommended to use up-to-date hardware when using Procore?,91,https://support.procore.com/faq/why-is-it-recommended-to-use-up-to-date-hardware-when-using-procore,32618,"Tue, 17 Apr 2018 23:47:02 GMT"
Can I print or export a copy of my bid in the Bid Room?,90,https://support.procore.com/faq/can-i-print-or-export-a-copy-of-my-bid-in-the-bid-room,87036,"Wed, 24 Jun 2020 00:58:13 GMT"
How does Procore handle viruses in uploaded files?,88,https://support.procore.com/faq/how-does-procore-handle-viruses-in-uploaded-files,31657,"Mon, 02 Apr 2018 21:37:32 GMT"
What is maintenance?,88,https://support.procore.com/faq/what-is-maintenance,137945,"Tue, 10 Aug 2021 23:10:55 GMT"
What are the default fieldset configurations for Procore's 'Bulletin' template correspondence type?,88,https://support.procore.com/faq/what-are-the-default-fieldset-configurations-for-procores-bulletin-template-correspondence-type,146611,"Wed, 01 Dec 2021 01:39:08 GMT"
How do I edit an initial award amount for a contract in Portfolio Financials?,87,https://support.procore.com/faq/how-do-i-edit-an-initial-award-amount-for-a-contract-in-portfolio-financials,98603,"Tue, 15 Sep 2020 21:45:42 GMT"
"How Do I Resolve the ""This export cannot be completed because the number of line items in QuickBooks does not match up with the number in Procore."" Error when Exporting to ERP",87,https://support.procore.com/faq/how-to-resolve-export-cannot-be-completed-because-the-number-of-line-items-does-not-match-up-quickbooks,146543,"Mon, 29 Nov 2021 22:57:55 GMT"
What are the default fieldset configurations for Procore's 'Change Request' template correspondence type?,87,https://support.procore.com/faq/what-are-the-default-fieldset-configurations-for-procores-change-request-template-correspondence-type,146613,"Wed, 01 Dec 2021 01:43:46 GMT"
How do I access a private support sandbox?,87,https://support.procore.com/faq/how-do-i-access-a-private-support-sandbox,3254,"Mon, 15 Jun 2015 17:23:48 GMT"
Which filters can I apply to the Change Events tool?,85,https://support.procore.com/faq/which-filters-can-i-apply-to-the-change-events-tool,123898,"Fri, 26 Mar 2021 17:17:25 GMT"
(Beta) How are version numbers updated in the Company level Workflows tool?,84,https://support.procore.com/faq/how-are-version-numbers-updated-in-the-company-level-workflows-tool,136544,"Wed, 21 Jul 2021 18:33:25 GMT"
How can I unaward a bid or contract in Portfolio Financials?,84,https://support.procore.com/faq/how-can-i-unaward-a-bid-or-contract-in-portfolio-financials,86929,"Tue, 23 Jun 2020 01:27:35 GMT"
"Can I apply custom segments to my existing, non-WBS projects?",83,https://support.procore.com/faq/can-i-apply-custom-segments-to-my-existing-non-wbs-projects,151277,"Mon, 31 Jan 2022 21:36:55 GMT"
How can I grant a 'Limited' user access to a specific Bid Room in Portfolio Financials?,83,https://support.procore.com/faq/how-can-i-grant-a-limited-user-access-to-a-specific-bid-room-in-portfolio-financials,92645,"Sat, 08 Aug 2020 01:11:07 GMT"
(DRAFT) What emails are sent for the Tasks tool?,82,https://support.procore.com/faq/what-emails-are-sent-for-the-tasks-tool,66613,"Fri, 03 Jan 2020 23:49:15 GMT"
How can I budget individual values within a cost item in Portfolio Financials?,81,https://support.procore.com/faq/how-can-i-budget-individual-values-within-a-cost-item-in-portfolio-financials,91679,"Thu, 30 Jul 2020 18:29:07 GMT"
"Superuser: How do I resolve a ""Could not connect to Procore VDC service"" error in the Procore plug-in for Coordination Issues?",80,https://support.procore.com/faq/superuser-how-do-i-resolve-a-could-not-connect-to-procore-vdc-service-error-in-procore-plugin-for-coordination-issues,44316,"Mon, 07 Jan 2019 22:16:42 GMT"
How do I log in to Portfolio Financials and Capital Planning?,79,https://support.procore.com/faq/how-do-i-log-in-to-portfolio-financials-and-capital-planning,100956,"Tue, 29 Sep 2020 18:15:17 GMT"
How do I opt in to the new Bidding experience?,78,https://support.procore.com/faq/how-do-i-opt-in-to-the-new-bidding-experience,168829,"Mon, 15 Aug 2022 21:03:03 GMT"
How do I register for a Training Center QA Session?,78,https://support.procore.com/faq/how-do-i-register-for-a-training-center-qa-session,23384,"Mon, 21 Aug 2017 22:03:36 GMT"
How can bidders get locked out of a sealed Bid Room in Portfolio Financials?,78,https://support.procore.com/faq/how-can-bidders-get-locked-out-of-a-sealed-bid-room-in-portfolio-financials,86743,"Fri, 19 Jun 2020 22:19:09 GMT"
How do I know if an RFI that I posted in the Bid Room has been answered?,78,https://support.procore.com/faq/how-do-i-know-if-an-rfi-that-i-posted-in-the-bid-room-has-been-answered,87031,"Wed, 24 Jun 2020 00:36:18 GMT"
Why can't my vendor access the Bid Room in Portfolio Financials?,78,https://support.procore.com/faq/why-cant-my-vendor-access-the-bid-room-in-portfolio-financials,94383,"Thu, 27 Aug 2020 00:52:38 GMT"
What is an incident?,77,https://support.procore.com/faq/what-is-an-incident,137821,"Tue, 10 Aug 2021 19:08:37 GMT"
Why can't I see the Bid Room in Portfolio Financials?,77,https://support.procore.com/faq/why-cant-i-see-the-bid-room-in-portfolio-financials,94380,"Wed, 26 Aug 2020 23:45:25 GMT"
How does privacy differ between the Correspondence tool and the rest of Procore?,76,https://support.procore.com/faq/how-does-privacy-differ-between-the-correspondence-tool-and-the-rest-of-procore,77568,"Fri, 10 Apr 2020 02:55:26 GMT"
How can I share access to a Bid Room in Portfolio Financials?,76,https://support.procore.com/faq/how-can-i-share-access-to-a-bid-room-in-portfolio-financials,87534,"Mon, 29 Jun 2020 23:57:02 GMT"
How can I share access to a Contract Room in Portfolio Financials?,75,https://support.procore.com/faq/how-can-i-share-access-to-a-contract-room-in-portfolio-financials,87536,"Tue, 30 Jun 2020 00:20:33 GMT"
What are some best practices for Reporting in Portfolio Financials and Capital Planning?,75,https://support.procore.com/faq/what-are-some-best-practices-for-reporting-in-portfolio-financials-and-capital-planning,99242,"Tue, 22 Sep 2020 21:40:49 GMT"
What are the default fieldset configurations for Procore's 'Material Request' template correspondence type?,74,https://support.procore.com/faq/what-are-the-default-fieldset-configurations-for-procores-material-request-template-correspondence-type,146641,"Wed, 01 Dec 2021 02:22:38 GMT"
How do I add a building to my account in Portfolio Financials?,74,https://support.procore.com/faq/how-do-i-add-a-building-to-my-account-in-portfolio-financials,86463,"Tue, 16 Jun 2020 19:02:54 GMT"
Why did a 'import operation took longer than set timeout' error appear when exporting a Commitment Change Order to Sage 300 CRE?,72,https://support.procore.com/faq/why-did-a-import-operation-took-longer-than-set-timeout-error-appear-when-exporting-a-cco-to-sage-300-cre,49531,"Wed, 10 Apr 2019 17:47:56 GMT"
Do milestones in Portfolio Financials sync with my external project schedule?,72,https://support.procore.com/faq/do-milestones-in-portfolio-financials-sync-with-my-external-project-schedule,89798,"Thu, 09 Jul 2020 22:30:16 GMT"
How do I enable Cost Allocations and Components for a Portfolio Financials project?,72,https://support.procore.com/faq/how-do-i-enable-cost-allocations-and-components-for-a-portfolio-financials-project,92765,"Tue, 11 Aug 2020 21:47:02 GMT"
What is the 'My Tasks' page in Portfolio Financials and Capital Planning?,71,https://support.procore.com/faq/what-is-the-my-tasks-page-in-portfolio-financials-and-capital-planning,100965,"Tue, 29 Sep 2020 18:38:46 GMT"
How can I view a custom Training Center?,70,https://support.procore.com/faq/Why_can't_I_see_my_company_Training_Center%3F,136525,"Wed, 21 Jul 2021 15:14:33 GMT"
"The 'plug' icon was removed, how do I navigate to the Marketplace?",70,https://support.procore.com/faq/plug-icon-missing-marketplace-nav-how-to,116061,"Wed, 20 Jan 2021 16:33:32 GMT"
Can I receive a daily activity summary for Portfolio Financials and Capital Planning?,69,https://support.procore.com/faq/can-i-receive-a-daily-activity-summary-for-portfolio-financials-and-capital-planning,94027,"Tue, 25 Aug 2020 19:03:37 GMT"
What are the data points for Capital Plans in Portfolio Financials and Capital Planning?,69,https://support.procore.com/faq/what-are-the-data-points-for-capital-plans-in-portfolio-financials-and-capital-planning,100070,"Fri, 25 Sep 2020 18:12:46 GMT"
"Superuser: How do I resolve a ""We're sorry, there was an error getting the API token"" error in the Procore plug-in for Coordination Issues?",69,https://support.procore.com/faq/superuser-how-do-i-resolve-a-were-sorry-there-was-an-error-getting-the-api-token-error-in-the-procore-plugin-for-coordination-issues,44319,"Mon, 07 Jan 2019 22:31:42 GMT"
What should I know about the Contract Room in Portfolio Financials?,68,https://support.procore.com/faq/what-should-i-know-about-the-contract-room-in-portfolio-financials,96934,"Fri, 11 Sep 2020 18:24:05 GMT"
(Draft) What are the required user permissions for editing a change order?,68,https://support.procore.com/faq/what-are-the-required-user-permissions-for-editing-a-change-order,145821,"Sun, 21 Nov 2021 14:10:04 GMT"
What are the default fieldset configurations for Procore's 'Extension of Time' template correspondence type?,67,https://support.procore.com/faq/what-are-the-default-fieldset-configurations-for-procores-extension-of-time-template-correspondence-type,146623,"Wed, 01 Dec 2021 02:01:58 GMT"
What is a Subcontractor Schedule of Values?,67,https://support.procore.com/faq/what-is-a-subcontractor-schedule-of-values,152372,"Fri, 11 Feb 2022 22:44:45 GMT"
What is the Project Page in Portfolio Financials and Capital Planning?,67,https://support.procore.com/faq/what-is-the-project-page-in-portfolio-financials-and-capital-planning,87352,"Thu, 25 Jun 2020 22:44:18 GMT"
How can I run a best and final round of bidding in Portfolio Financials?,67,https://support.procore.com/faq/how-can-i-run-a-best-and-final-round-of-bidding-in-portfolio-financials,86757,"Sat, 20 Jun 2020 00:38:31 GMT"
"How Do I Resolve the ""There was an error adding, modifying or deleting XXXXXX-XXXXXXXXXXX because it is already in use."" Error when Exporting to ERP",65,https://support.procore.com/faq/how-to-resolve-there-was-an-error-adding-modifying-deleting-because-it-is-already-in-use-quickbooks,146575,"Tue, 30 Nov 2021 16:28:28 GMT"
How do I enable retainage for a contract in Portfolio Financials?,65,https://support.procore.com/faq/how-do-i-enable-retainage-for-a-contract-in-portfolio-financials,86924,"Tue, 23 Jun 2020 00:26:02 GMT"
What are Uncategorized Invoices in Portfolio Financials?,65,https://support.procore.com/faq/what-are-uncategorized-invoices-in-portfolio-financials,100885,"Mon, 28 Sep 2020 21:50:31 GMT"
How do I enter budgeted projects for the year in Portfolio Financials and Capital Planning?,63,https://support.procore.com/faq/how-do-i-enter-budgeted-projects-for-the-year-in-portfolio-financials-and-capital-planning,99064,"Fri, 18 Sep 2020 18:54:18 GMT"
What should I do if I forgot my password for Portfolio Financials?,62,https://support.procore.com/faq/what-should-i-do-if-i-forgot-my-password-for-portfolio-financials,86461,"Tue, 16 Jun 2020 18:48:39 GMT"
How do I navigate to a Bid Room in Portfolio Financials?,61,https://support.procore.com/faq/how-do-i-navigate-to-a-bid-room-in-portfolio-financials,88635,"Wed, 01 Jul 2020 18:35:52 GMT"
How do I check what Procore tools are included with my Procore account?,61,https://support.procore.com/faq/how-do-i-check-what-procore-tools-are-included-with-my-procore-account,169873,"Tue, 23 Aug 2022 15:22:09 GMT"
What is Capital Construction Solutions and how does it integrate with Procore?,61,https://support.procore.com/integrations/real-time-risk-solutions/faq/what-is-ccsanalytics-and-how-does-it-integrate-with-procore,12291,"Mon, 19 Dec 2016 18:56:35 GMT"
What are the default fieldset configurations for Procore's 'General Correspondence' template correspondence type?,60,https://support.procore.com/faq/what-are-the-default-fieldset-configurations-for-procores-general-correspondence-template-correspondence-type,146625,"Wed, 01 Dec 2021 02:05:50 GMT"
What are the default fieldset configurations for Procore's 'Notice of Delay' template correspondence type?,60,https://support.procore.com/faq/what-are-the-default-fieldset-configurations-for-procores-notice-of-delay-template-correspondence-type,146645,"Wed, 01 Dec 2021 02:28:08 GMT"
What are the default fieldset configurations for Procore's 'Letters' template correspondence type?,59,https://support.procore.com/faq/what-are-the-default-fieldset-configurations-for-procores-letters-template-correspondence-type,146636,"Wed, 01 Dec 2021 02:16:44 GMT"
Integration by Procore: How do I export cost forecast data from a Procore budget to Viewpoint® Spectrum®?,59,https://support.procore.com/faq/how-do-i-export-cost-forecast-data-from-a-procore-budget-to-viewpoint-spectrum,162521,"Fri, 17 Jun 2022 20:10:15 GMT"
What are the default statuses for T&M tickets?,58,https://support.procore.com/faq/what-are-the-default-statuses-for-tm-tickets,142256,"Fri, 01 Oct 2021 21:19:17 GMT"
