title,views,url,id,dateCreated
Which filters are supported in the Portfolio tool's views?,376,https://support.procore.com/faq/which-filters-are-supported-in-the-portfolio-tools-views,22701,"Wed, 02 Aug 2017 18:53:08 GMT"
How does the hh2 synchronization client connect Procore to Sage 100 Contractor?,375,https://support.procore.com/faq/how-does-the-hh2-synchronization-client-connect-procore-to-sage-100-contractor,41219,"Thu, 08 Nov 2018 18:57:06 GMT"
Why are my training courses missing?,373,https://support.procore.com/faq/why-are-my-training-courses-missing,16822,"Wed, 26 Apr 2017 18:02:43 GMT"
How do I log into Procore using Microsoft Azure AD SSO?,370,https://support.procore.com/faq/how-do-i-log-into-procore-using-azure-ad-sso,10700,"Thu, 08 Sep 2016 18:12:20 GMT"
Why are some of my sub folders in my [Bid Documents] folder not showing up when my bidders download them?,369,https://support.procore.com/faq/why-are-some-of-my-sub-folders-in-my-bid-documents-folder-not-showing-up-when-my-bidders-download-them,1319,"Wed, 18 Feb 2015 18:44:50 GMT"
How can I use the '[OSHA] Materials Handling' inspection template on my project?,364,https://support.procore.com/faq/how-can-i-use-the-osha-materials-handling-inspection-template-on-my-project,75959,"Thu, 02 Apr 2020 04:35:35 GMT"
(Beta) What are the different types of steps in a custom workflow?,361,https://support.procore.com/faq/what-are-the-different-types-of-steps-in-a-custom-workflow,136612,"Thu, 22 Jul 2021 22:50:49 GMT"
When is a submittal attachment labeled as 'Current' in the 'Submittal Workflow' table?,360,https://support.procore.com/faq/when-is-a-submittal-attachment-labeled-as-current-in-the-submittal-worfklow-table,120777,"Fri, 05 Mar 2021 21:11:30 GMT"
What emails are sent during the bidding process in Portfolio Financials?,357,https://support.procore.com/faq/what-emails-are-sent-during-the-bidding-process-in-portfolio-financials,86748,"Fri, 19 Jun 2020 23:13:50 GMT"
Can I upload fillable PDFs that are password protected?,356,https://support.procore.com/faq/can-i-upload-fillable-pdfs-that-are-password-protected,24493,"Mon, 25 Sep 2017 22:00:04 GMT"
Can I copy estimates from the Estimating tool to a new project?,351,https://support.procore.com/faq/can-i-copy-estimates-from-the-estimating-tool-to-a-new-project,145805,"Fri, 19 Nov 2021 19:04:33 GMT"
Can I change the language that Procore scans my drawings for?,348,https://support.procore.com/faq/can-i-change-the-language-that-procore-scans-my-drawings-for,66975,"Thu, 09 Jan 2020 21:26:30 GMT"
How do I enter a credit invoice in Portfolio Financials?,348,https://support.procore.com/faq/how-do-i-enter-a-credit-invoice-in-portfolio-financials,98601,"Tue, 15 Sep 2020 21:34:20 GMT"
Why aren't my grids aligned in the Models tool?,347,https://support.procore.com/faq/why-arent-my-grids-aligned-in-the-models-tool,121784,"Thu, 11 Mar 2021 23:03:11 GMT"
Can I import a CSV into a Project Financials tool's schedule of values if it has blank values?,347,https://support.procore.com/faq/can-i-import-a-csv-into-a-project-financial-tools-schedule-of-values-if-it-has-blank-values,1947,"Mon, 09 Mar 2015 18:46:03 GMT"
What is iSqFt and how does it integrate with Procore?,347,https://support.procore.com/faq/what-is-isqft-and-how-does-it-integrate-with-procore,12208,"Mon, 12 Dec 2016 23:38:10 GMT"
What fields are searched in the Directory tool?,345,https://support.procore.com/faq/what-fields-are-searched-in-the-directory-tool,46924,"Wed, 13 Feb 2019 18:58:48 GMT"
What are the different 'user roles' in Procore Estimating?,341,https://support.procore.com/faq/what-are-the-different-user-roles-in-procore-estimating,125452,"Thu, 22 Apr 2021 00:07:04 GMT"
Which cost code formats are supported by Procore + Sage 300 CRE?,335,https://support.procore.com/faq/which-cost-code-formats-are-supported-by-procore-sage-300-cre,1347,"Wed, 18 Feb 2015 20:07:55 GMT"
"How can I view reports of a single log, or a single person within a log?",331,https://support.procore.com/faq/how-can-i-view-reports-of-a-single-log-or-a-single-person-within-a-log,1558,"Tue, 24 Feb 2015 19:32:23 GMT"
Does Procore Sync support proxy servers?,331,https://support.procore.com/faq/does-procore-sync-support-proxy-servers,54306,"Fri, 12 Jul 2019 19:59:52 GMT"
Who receives emails about coordination issues?,330,https://support.procore.com/faq/who-receives-emails-about-coordination-issues,58671,"Tue, 24 Sep 2019 23:32:59 GMT"
What is a 'Completed Action Plan Receiver'?,329,https://support.procore.com/faq/what-is-a-completed-action-plan-receiver,114377,"Fri, 15 Jan 2021 21:23:59 GMT"
What is Procore Community?,328,https://support.procore.com/faq/what-is-procore-community,100962,"Tue, 29 Sep 2020 18:29:39 GMT"
Why can’t I use the cloud redline tool in Navisworks®?,327,https://support.procore.com/faq/why-cant-i-use-the-cloud-redline-tool-in-navisworks,37720,"Thu, 23 Aug 2018 19:52:09 GMT"
How can I add the '[Procore] Project Shutdown' inspection template to my Procore account?,324,https://support.procore.com/faq/how-can-i-add-the-procore-project-shutdown-inspection-template-to-my-procore-account,80617,"Thu, 30 Apr 2020 19:10:58 GMT"
How should I adjust my forecast view if the Prime Contracts tool is disabled?,323,https://support.procore.com/faq/how-should-adjust-my-forecast-view-if-the-prime-contract-tool-is-disabled,24486,"Mon, 25 Sep 2017 16:08:56 GMT"
What data is synced between Procore and Sage 100 Contractor?,322,https://support.procore.com/faq/what-data-is-synced-between-procore-and-sage-100-contractor,41241,"Thu, 08 Nov 2018 21:36:44 GMT"
What is a 'Plan Manager' in an action plan?,319,https://support.procore.com/faq/what-is-a-plan-manager-in-an-action-plan,114373,"Fri, 15 Jan 2021 21:17:55 GMT"
How do I export cost forecast data from a Procore budget to Viewpoint® Vista™,315,https://support.procore.com/faq/how-do-i-export-cost-forecast-data-from-a-procore-budget-to-viewpoint-vista,145297,"Wed, 17 Nov 2021 18:18:25 GMT"
Why didn't I receive an email notification from a submittal?,310,https://support.procore.com/faq/why-didnt-i-receive-an-email-notification-from-a-submittal,159217,"Fri, 29 Apr 2022 18:39:23 GMT"
How do I choose a Default Punch Item Manager for my project?,310,https://support.procore.com/faq/how-do-i-choose-a-default-punch-item-manager-for-my-project,84051,"Sat, 30 May 2020 00:43:55 GMT"
How does the hh2 synchronization client transmit data?,306,https://support.procore.com/faq/how-does-the-hh2-synchronization-client-transmit-data,1547,"Tue, 24 Feb 2015 18:00:50 GMT"
Does the estimate feature in QuickBooks® need to be enabled to work with Procore's Budget tool?,306,https://support.procore.com/integrations/quickbooks/faq/does-the-estimate-feature-in-quickbooks-need-to-be-enabled-to-work-with-procores-budget-tool,11802,"Thu, 10 Nov 2016 23:39:42 GMT"
How do my project-specific 'Cost Code' segment items get carried over from a project template to a new project?,305,https://support.procore.com/faq/how-do-my-project-specific-cost-code-segment-items-get-carried-over-to-a-new-project-from-a-project-template,156859,"Wed, 06 Apr 2022 20:42:03 GMT"
Where is the Live Project Cam area in Procore?,303,https://support.procore.com/faq/where-is-the-live-project-cam-area-in-procore,10795,"Mon, 19 Sep 2016 17:37:40 GMT"
How do invoice approvals work in Portfolio Financials?,302,https://support.procore.com/faq/how-do-invoice-approvals-work-in-portfolio-financials,86429,"Tue, 16 Jun 2020 02:05:51 GMT"
How does the 'Actuals By Date' filter work on a budget view?,301,https://support.procore.com/faq/how-does-the-actual-date-filter-work-on-a-budget-view,119350,"Wed, 24 Feb 2021 17:27:15 GMT"
Where can I sign up for free public trainings?,300,https://support.procore.com/faq/where-can-i-sign-up-for-free-public-trainings,1954,"Mon, 09 Mar 2015 19:16:51 GMT"
How do I create or join a Zoom meeting in Procore?,297,https://support.procore.com/faq/how-do-i-create-or-join-a-zoom-meeting-in-procore,77024,"Tue, 07 Apr 2020 19:44:16 GMT"
Which emails are affected by the updated inbound email communication settings in Procore?,293,https://support.procore.com/faq/which-emails-are-affected-by-the-updated-inbound-email-communication-settings-in-procore,114357,"Fri, 15 Jan 2021 17:21:44 GMT"
Is data automatically synchronized between ProEst and Procore?,291,https://support.procore.com/faq/is-data-automatically-synchronized-between-proest-and-procore,4794,"Wed, 25 Nov 2015 02:00:50 GMT"
Which settings are available in Procore?,289,https://support.procore.com/faq/which-settings-are-available-in-procore,49361,"Sat, 06 Apr 2019 00:12:33 GMT"
Why isn't the project's budget view reflecting labor costs and production quantities from timecard entries?,289,https://support.procore.com/faq/why-isnt-the-projects-budget-view-reflecting-labor-costs-and-production-quantities-from-timecard-entries,92599,"Fri, 07 Aug 2020 16:35:50 GMT"
Does the DocuSign® integration have any file size limits on attachments or envelopes?,289,https://support.procore.com/faq/does-the-docusign-integration-have-any-file-size-limits-on-attachments-or-envelopes,124088,"Tue, 30 Mar 2021 17:22:15 GMT"
Why can't I log in to my Certification Analytics Dashboard?,286,https://support.procore.com/faq/why-cant-i-log-in-to-my-certification-analytics-dashboard,66609,"Fri, 03 Jan 2020 22:30:50 GMT"
Can you make a correspondence that is set to private public?,284,https://support.procore.com/faq/can-you-make-a-correspondence-that-is-set-to-private-public,75748,"Tue, 31 Mar 2020 04:08:03 GMT"
Which Procore tools support Work Breakdown Structure?,282,https://support.procore.com/faq/which-procore-tools-support-work-breakdown-structure,150377,"Tue, 25 Jan 2022 19:05:15 GMT"
Why can't I see the Favorites tab in My Profile Settings?,277,https://support.procore.com/faq/why-cant-i-see-the-favorites-tab-in-my-profile-settings,22924,"Tue, 08 Aug 2017 18:47:59 GMT"
How do Procore's 'Advanced Forecasting' curves distribute 'Projected Cost to Complete Amounts' amounts?,277,https://support.procore.com/faq/how-do-procores-advanced-forecasting-curves-distribute-projected-cost-to-complete-amounts,132001,"Tue, 22 Jun 2021 18:58:12 GMT"
Are pending commitments automatically synced with integrated ERP systems?,276,https://support.procore.com/faq/are-pending-commitments-automatically-synced-with-integrated-erp-systems,1343,"Wed, 18 Feb 2015 20:03:59 GMT"
Which project settings from the Admin tool carry over from a project template?,276,https://support.procore.com/faq/which-project-settings-from-the-admin-tool-carry-over-from-a-project-template,32128,"Fri, 06 Apr 2018 21:46:09 GMT"
Do I need to create a dedicated user account in Sage 300 CRE for the hh2 synchronization client?,275,https://support.procore.com/faq/do-i-need-to-create-a-dedicated-user-account-in-sage-for-the-hh2-syncrhonization-client,1544,"Tue, 24 Feb 2015 17:50:12 GMT"
How will my previous equipment entries from the Site Diary work with the Equipment tool?,274,https://support.procore.com/faq/how-will-my-previous-equipment-entries-from-the-site-diary-work-with-the-equipment-tool,44597,"Thu, 10 Jan 2019 17:52:08 GMT"
Can I view a live video feed in Procore Mobile?,270,https://support.procore.com/faq/can-i-view-a-live-video-feed-in-procore-mobile,3427,"Thu, 25 Jun 2015 09:12:47 GMT"
Which Procore tools let me view digital image attachments in a map view?,268,https://support.procore.com/faq/which-procore-tools-let-me-view-a-digital-image-attachment-in-a-map-view,160268,"Tue, 10 May 2022 14:52:44 GMT"
How do I avoid and report phishing emails?,262,https://support.procore.com/faq/how-do-i-avoid-and-report-phishing-emails,56244,"Wed, 14 Aug 2019 17:46:11 GMT"
How do I determine whether a punch list item has been sent?,260,https://support.procore.com/faq/how-do-i-determine-whether-a-punch-list-item-has-been-sent,1381,"Thu, 19 Feb 2015 19:17:10 GMT"
What are Touch Commands?,259,https://support.procore.com/faq/what-are-touch-commands,7031,"Wed, 23 Mar 2016 23:13:27 GMT"
What are the default columns in the Contracts tab of the Commitments tool?,259,https://support.procore.com/faq/what-are-the-default-columns-in-the-contracts-tab-of-the-commitments-tool,119614,"Sat, 27 Feb 2021 00:23:34 GMT"
What should I know about Approval Workflows in Portfolio Financials?,258,https://support.procore.com/faq/what-should-i-know-about-approval-workflows-in-portfolio-financials,86387,"Mon, 15 Jun 2020 21:31:16 GMT"
Why is my model not respecting the Appearance Profiler?,257,https://support.procore.com/faq/why-is-my-model-not-respecting-the-appearance-profiler,57668,"Wed, 11 Sep 2019 18:51:14 GMT"
Which Procore tools can I use to add production quantities to my project's budget?,252,https://support.procore.com/faq/which-procore-tools-can-i-use-to-add-production-quantities-to-my-projects-budget,84338,"Wed, 03 Jun 2020 22:22:37 GMT"
How often can I sync data using the Integration by Ryvit?,251,https://support.procore.com/faq/how-often-can-i-sync-data-using-the-integration-by-ryvit,23635,"Mon, 28 Aug 2017 16:18:38 GMT"
How does the X.509 certificate upgrade impact users?,249,https://support.procore.com/faq/how-does-x509-certificate-upgrade-impact-users,61043,"Mon, 28 Oct 2019 16:18:57 GMT"
How often can I sync data between Procore and Viewpoint® Spectrum®?,249,https://support.procore.com/faq/how-often-can-i-sync-data-between-procore-and-viewpoint-spectrum,9948,"Thu, 18 Aug 2016 15:52:21 GMT"
What is the maximum character length for a Sub Job?,248,https://support.procore.com/faq/what-is-the-maximum-character-length-for-a-sub-job,38487,"Fri, 07 Sep 2018 16:17:18 GMT"
"Which fields in the Documents tool can be configured as required, optional, or hidden?",246,https://support.procore.com/faq/which-fields-in-the-documents-tool-can-be-configured-as-required-optional-or-hidden,84139,"Tue, 02 Jun 2020 17:05:43 GMT"
"I thought I added a user, but now I can't find that person. What happened?",245,https://support.procore.com/faq/i-thought-i-added-a-user-but-now-i-cant-find-that-person-what-happened,1995,"Tue, 10 Mar 2015 15:59:25 GMT"
How do approval workflows get set up in Portfolio Financials?,244,https://support.procore.com/faq/how-do-approval-workflows-get-set-up-in-portfolio-financials,86384,"Mon, 15 Jun 2020 21:07:21 GMT"
How do I run a sealed bid process in Portfolio Financials?,241,https://support.procore.com/faq/how-do-i-run-a-sealed-bid-process-in-portfolio-financials,86478,"Tue, 16 Jun 2020 21:51:43 GMT"
What do I need to know about the Vapid API deprecation?,239,https://support.procore.com/faq/what-to-know-vapid-api-deprecation,114313,"Thu, 14 Jan 2021 22:30:59 GMT"
What file types are supported for the 3D model viewer in the Documents tool?,238,https://support.procore.com/faq/what-file-types-are-supported-for-the-3d-model-viewer-in-the-documents-tool,165042,"Fri, 15 Jul 2022 21:29:04 GMT"
Can I apply permissions templates to multiple users at one time?,237,https://support.procore.com/faq/can-i-apply-permissions-templates-to-multiple-users-at-one-time,50065,"Wed, 24 Apr 2019 17:19:54 GMT"
"Which fields in the Specifications tool can be configured as required, optional, or hidden?",237,https://support.procore.com/faq/which-fields-in-the-specifications-tool-can-be-configured-as-required-optional-or-hidden,80926,"Mon, 04 May 2020 23:09:56 GMT"
What are Milestone Dependencies in Portfolio Financials and how do I set them?,231,https://support.procore.com/faq/what-are-milestone-dependencies-in-portfolio-financials-and-how-do-i-set-them,87538,"Tue, 30 Jun 2020 00:48:13 GMT"
Why did Procore switch from procoretech.com to app.procore.com?,228,https://support.procore.com/faq/why-did-procore-switch-from-procoretech-to-app.procore,3709,"Wed, 29 Jul 2015 22:32:26 GMT"
What is a 'private' timecard and which timecards can be set to private?,222,https://support.procore.com/faq/what-is-a-private-timecard-and-which-timecards-can-be-set-to-private,142731,"Tue, 12 Oct 2021 15:59:05 GMT"
How do bid approvals work in Portfolio Financials?,218,https://support.procore.com/faq/how-do-bid-approvals-work-in-portfolio-financials,86423,"Tue, 16 Jun 2020 00:52:00 GMT"
How do I filter out 'Recycled' items from a custom RFIs report?,218,https://support.procore.com/faq/how-do-i-filter-out-recycled-items-from-a-custom-rfis-report,34103,"Tue, 22 May 2018 21:14:26 GMT"
What are Procore's standard budget views for ERP Integrations?,217,https://support.procore.com/faq/what-are-procores-standard-budget-views-for-erp-integrations,69279,"Tue, 04 Feb 2020 17:00:34 GMT"
What are Cost Allocations and Components in Portfolio Financials?,214,https://support.procore.com/faq/what-are-cost-allocations-and-components-in-portfolio-financials,92721,"Tue, 11 Aug 2020 01:36:04 GMT"
Can I integrate an existing Sage project with Procore?,213,https://support.procore.com/faq/can-integrate-an-existing-sage-project-with-procore,1328,"Wed, 18 Feb 2015 19:38:13 GMT"
What is the Date Notified field in my Punch List?,212,https://support.procore.com/faq/what-is-the-date-notified-field-in-my-punch-list,13156,"Thu, 05 Jan 2017 19:16:02 GMT"
"Which fields in the Prime Contracts tool can be configured as required, optional, or hidden?",212,https://support.procore.com/faq/which-fields-in-the-prime-contracts-tool-can-be-configured-as-required-optional-or-hidden,136600,"Thu, 22 Jul 2021 21:20:57 GMT"
What are Approvals in Portfolio Financials?,211,https://support.procore.com/faq/what-are-approvals-in-portfolio-financials,86389,"Mon, 15 Jun 2020 21:52:21 GMT"
How do I set up my account in Workforce Planning?,211,https://support.procore.com/faq/how-do-I-set-up-my-account-in-workforce-planning,164763,"Wed, 13 Jul 2022 15:18:57 GMT"
How many Quickbooks company files does Procore support?,209,https://support.procore.com/integrations/quickbooks/faq/how-many-quickbooks-company-files-does-procore-support,11797,"Thu, 10 Nov 2016 23:21:42 GMT"
"How do I resolve the ""A commitment with code already exists"" Error when Exporting to ERP",208,https://support.procore.com/faq/how-to-resolve-commitment-with-code-already-exists-sage-300,146578,"Tue, 30 Nov 2021 16:43:24 GMT"
Can I make timecard entries at the Project level?,207,https://support.procore.com/faq/can-i-make-timecard-entries-at-the-project-level,1892,"Fri, 06 Mar 2015 00:02:20 GMT"
How do I switch between Portfolio Financials and Project Management toolkits in Procore?,207,https://support.procore.com/faq/how-do-i-switch-between-portfolio-financials-and-project-management-toolkits-in-procore,73844,"Wed, 11 Mar 2020 21:57:48 GMT"
How do I perform a hard refresh in my web browser?,206,https://support.procore.com/faq/how-do-i-perform-a-hard-refresh-in-my-web-browser,152200,"Thu, 10 Feb 2022 20:13:58 GMT"
How do I select which Viewpoint® Spectrum® jobs appear in the Select a Job Template list of the ERP Integrations tool?,203,https://support.procore.com/faq/how-to-i-select-which-viewpoint-spectrum-jobs-appear-in-the-select-a-job-template-list-of-the-erp-integrations-tool,49862,"Thu, 18 Apr 2019 22:11:52 GMT"
(Beta) What are the different roles within Custom Workflows?,202,https://support.procore.com/faq/what-are-the-different-roles-within-custom-workflows,136904,"Mon, 26 Jul 2021 19:59:56 GMT"
What are the user roles in the Submittals tool?,199,https://support.procore.com/faq/what-are-the-user-roles-in-the-submittals-tool,161906,"Wed, 08 Jun 2022 18:28:20 GMT"
How can I check who has permissions to see a type of correspondence?,197,https://support.procore.com/faq/how-can-i-check-who-has-permissions-to-see-a-type-of-correspondence,75942,"Wed, 01 Apr 2020 23:51:04 GMT"
How do change order approvals work in Portfolio Financials?,195,https://support.procore.com/faq/how-do-change-order-approvals-work-in-portfolio-financials,86427,"Tue, 16 Jun 2020 01:53:09 GMT"
"Which fields in the Invoicing or Progress Billings tools can be configured as required, optional, or hidden?",195,https://support.procore.com/faq/which-fields-in-the-invoicing-or-progress-billings-tools-can-be-configured-as-required-optional-or-hidden,161638,"Tue, 31 May 2022 02:20:00 GMT"
How can I add custom bid form templates for the Bid Room in Portfolio Financials?,192,https://support.procore.com/faq/how-can-i-add-custom-bid-form-templates-for-the-bid-room-in-portfolio-financials,87381,"Fri, 26 Jun 2020 18:19:27 GMT"
"What does the ""Search"" box in the Photos tool search for?",190,https://support.procore.com/faq/what-does-the-search-box-search-for,1631,"Thu, 26 Feb 2015 18:13:26 GMT"
What are the column header updates in the import templates?,190,https://support.procore.com/faq/what-are-the-column-header-updates-in-the-import-templates,61075,"Mon, 28 Oct 2019 18:36:15 GMT"
Which tools currently support the Bookmarks feature on the Procore mobile app?,190,https://support.procore.com/faq/which-tools-currently-support-the-bookmarks-feature-on-the-procore-mobile-app,161351,"Sat, 21 May 2022 00:23:25 GMT"
"Which fields in the Coordination Issues tool can be configured as required, optional, or hidden?",189,https://support.procore.com/faq/which-fields-in-the-coordination-issues-tool-can-be-configured-as-required-optional-or-hidden,114319,"Fri, 15 Jan 2021 00:30:08 GMT"
"How do I convert Procore support articles, tutorials, and FAQs into a PDF?",188,https://support.procore.com/faq/how-do-i-convert-procore-support-articles-tutorials-and-faqs-into-a-pdf,33047,"Wed, 02 May 2018 16:39:45 GMT"
How do I download the Mozilla Firefox browser?,186,https://support.procore.com/faq/how-do-i-download-the-mozilla-firefox-browser,7377,"Fri, 22 Apr 2016 17:13:05 GMT"
How do contract approvals work in Portfolio Financials?,186,https://support.procore.com/faq/how-do-contract-approvals-work-in-portfolio-financials,86425,"Tue, 16 Jun 2020 01:27:02 GMT"
What are the data points available for custom reports in Portfolio Financials and Capital Planning?,185,https://support.procore.com/faq/what-are-the-data-points-available-for-custom-reports-in-portfolio-financials-and-capital-planning,99120,"Fri, 18 Sep 2020 22:47:31 GMT"
Why can't I log in to Portfolio Financials and Capital Planning?,182,https://support.procore.com/faq/why-cant-i-log-in-to-portfolio-financials-and-capital-planning,73838,"Wed, 11 Mar 2020 21:15:56 GMT"
How do I export a project budget from Procore to Sage 300 CRE?,179,https://support.procore.com/faq/how-do-i-export-a-project-budget-from-procore-to-sage-300-cre,7861,"Tue, 17 May 2016 16:34:09 GMT"
Why can't my team member see a project in Portfolio Financials and Capital Planning?,179,https://support.procore.com/faq/why-cant-my-team-member-see-a-project-in-portfolio-financials-and-capital-planning,94372,"Wed, 26 Aug 2020 17:26:10 GMT"
What are some examples of reports I can generate in Portfolio Financials and Capital Planning?,179,https://support.procore.com/faq/what-are-some-examples-of-reports-i-can-generate-in-portfolio-financials-and-capital-planning,99237,"Tue, 22 Sep 2020 21:31:27 GMT"
How can I check who has permissions to see a specific correspondence?,179,https://support.procore.com/faq/how-can-i-check-who-has-permissions-to-see-a-specific-correspondence,75938,"Wed, 01 Apr 2020 23:21:08 GMT"
What values pull into a change order SOV from a change event?,177,https://support.procore.com/faq/what-values-pull-into-a-change-order-sov-from-a-change-event,158870,"Sat, 23 Apr 2022 00:02:52 GMT"
Where did the numbered templates on the Timesheets and My Time tool Fieldsets come from?,176,https://support.procore.com/faq/where-did-the-numbered-templates-on-the-timesheets-and-my-time-tool-fieldsets-come-from,134573,"Wed, 07 Jul 2021 16:44:35 GMT"
Can I set up multiple Favorites lists for my project tools to apply to different projects?,175,https://support.procore.com/faq/can-i-set-up-multiple-favorites-lists-for-my-project-tools-to-apply-to-different-projects,22963,"Wed, 09 Aug 2017 17:59:16 GMT"
Which prime contract and PCCO fields are synced with Procore and Viewpoint Spectrum?,175,https://support.procore.com/faq/which-prime-contract-and-pcco-fields-are-synced-with-procore-and-viewpoint-spectrum,70777,"Sun, 16 Feb 2020 18:09:47 GMT"
How do I add 'Procore' as an endorsable skill on my LinkedIn profile?,174,https://support.procore.com/faq/how-do-i-add-procore-as-an-endorsable-skill-on-my-linkedin-profile,4812,"Tue, 01 Dec 2015 10:45:57 GMT"
Can I export a correspondence if it is set to private?,174,https://support.procore.com/faq/can-i-export-a-correspondence-if-it-is-set-to-private,75766,"Tue, 31 Mar 2020 16:32:14 GMT"
How do I set up the 'Procore Labor Productivity Cost' budget view?,169,https://support.procore.com/faq/how-do-i-set-up-the-procore-labor-productivity-cost-view,87338,"Thu, 25 Jun 2020 17:06:40 GMT"
Why are viewpoints being created after I use the markup tools?,168,https://support.procore.com/faq/why-are-viewpoints-being-created-after-i-use-the-markup-tools,39435,"Fri, 28 Sep 2018 23:19:44 GMT"
What are the default columns in the Prime Contracts tool?,166,https://support.procore.com/faq/what-are-the-default-columns-in-the-prime-contracts-tool,124273,"Fri, 02 Apr 2021 18:23:02 GMT"
Can I import clashes and clash groups into the Coordination Issues tool?,166,https://support.procore.com/faq/can-i-import-clashes-and-clash-groups-into-the-coordination-issues-tool,37714,"Thu, 23 Aug 2018 19:01:50 GMT"
(Beta) When are email notifications sent for Self-Serve Custom Workflows?,166,https://support.procore.com/faq/when-are-email-notifications-sent-for-self-serve-custom-workflows,158741,"Fri, 22 Apr 2022 21:18:57 GMT"
How do budget approvals work in Portfolio Financials?,165,https://support.procore.com/faq/how-do-budget-approvals-work-in-portfolio-financials,86421,"Tue, 16 Jun 2020 00:09:52 GMT"
Why am I not seeing my issues after I associate the file to my project?,165,https://support.procore.com/faq/why-am-i-not-seeing-my-issues-after-i-associate-the-file-to-my-project,37723,"Thu, 23 Aug 2018 19:56:15 GMT"
