title,views,url,id,dateCreated
Do I need to create Procore user accounts if our company implements SSO?,1487,https://support.procore.com/faq/do-i-need-to-create-procore-user-accounts-if-our-company-implements-sso,11340,"Thu, 27 Oct 2016 23:08:30 GMT"
How can I use the '[NextWave Safety Solutions] Concrete Pre-Pour' inspection template on my project?,1479,https://support.procore.com/faq/how-can-i-use-the-nextwave-safety-solutions-concrete-pre-pour-inspection-template-on-my-project,75945,"Thu, 02 Apr 2020 03:55:17 GMT"
What if my spec sections or divisions start in the middle of a page?,1477,https://support.procore.com/faq/what-if-my-spec-sections-or-divisions-start-in-the-middle-of-a-page,4694,"Sat, 07 Nov 2015 04:12:18 GMT"
How do I mark an assignee as a required responder on an RFI?,1467,https://support.procore.com/faq/how-do-i-mark-an-assignee-as-a-required-responder-on-an-rfi,33481,"Tue, 08 May 2018 22:47:17 GMT"
What is Portfolio Financials?,1463,https://support.procore.com/faq/what-is-portfolio-financials,86445,"Tue, 16 Jun 2020 17:55:52 GMT"
How can I use the '[Procore] Equipment Pre-Operation Checklist' inspection template on my project?,1453,https://support.procore.com/faq/how-can-i-use-the-procore-equipment-pre-operation-checklist-inspection-template-on-my-project,75961,"Thu, 02 Apr 2020 04:50:24 GMT"
What is an advanced search symbol in Procore?,1449,https://support.procore.com/faq/what-is-an-advanced-search-symbol-in-procore,35545,"Tue, 26 Jun 2018 20:07:23 GMT"
What are Procore's standard budget views?,1431,https://support.procore.com/faq/what-are-procores-standard-budget-views,68962,"Thu, 30 Jan 2020 22:02:34 GMT"
Why is the Add Visual button unavailable on my custom report?,1423,https://support.procore.com/faq/why-is-the-add-visual-button-unavailable-on-my-custom-report,5730,"Fri, 19 Feb 2016 17:46:42 GMT"
How often can I sync data between Sage 300 CRE and Procore?,1419,https://support.procore.com/faq/how-often-can-i-sync-data-between-sage-300-cre-and-procore,1321,"Wed, 18 Feb 2015 19:29:40 GMT"
(Beta) How do I bill for stored materials in a subcontractor invoice?,1394,https://support.procore.com/faq/how-do-i-bill-for-stored-materials-in-a-subcontractor-invoice,106203,"Thu, 29 Oct 2020 19:43:05 GMT"
How do I use the navigation bar to go back to the Company Portfolio?,1383,https://support.procore.com/faq/how-do-i-use-the-navigation-bar-to-go-back-to-the-company-portfolio,16113,"Tue, 04 Apr 2017 22:48:51 GMT"
How do I enable additional workforce labor types for the Daily Log?,1381,https://support.procore.com/faq/how-do-i-enable-additional-workforce-labor-types-for-the-daily-log,51131,"Thu, 16 May 2019 01:04:19 GMT"
Can I disable the Change Events tool?,1365,https://support.procore.com/faq/can-i-disable-the-change-events-tool,89738,"Thu, 09 Jul 2020 15:28:35 GMT"
What is a Developer Managed Service Account?,1363,https://support.procore.com/faq/what-is-developer-managed-service-account,141308,"Thu, 23 Sep 2021 21:21:50 GMT"
Which canned reports are available in the Company level Reports tool?,1355,https://support.procore.com/faq/which-canned-reports-are-available-in-the-company-level-reports-tool,48322,"Fri, 15 Mar 2019 19:53:35 GMT"
How do I revoke project access for a Procore user?,1340,https://support.procore.com/faq/how-do-i-revoke-project-access-for-a-procore-user,13812,"Mon, 23 Jan 2017 18:25:52 GMT"
Can I use Procore Sync offline to update my files?,1332,https://support.procore.com/faq/can-i-use-procore-sync-offline-to-update-my-files,21137,"Tue, 27 Jun 2017 23:18:04 GMT"
What do the different icons on my files mean in Procore Sync?,1320,https://support.procore.com/faq/what-do-the-different-icons-on-my-files-mean-in-procore-sync,52411,"Mon, 10 Jun 2019 21:49:09 GMT"
How will my previous Timecard entries work with Timesheets?,1319,https://support.procore.com/faq/how-will-my-previous-timecard-entries-work-with-timesheets,23725,"Wed, 30 Aug 2017 20:31:38 GMT"
What is sliding scale retention?,1315,https://support.procore.com/faq/what-is-sliding-scale-retention,67153,"Fri, 10 Jan 2020 19:45:22 GMT"
Can I update the Percent Complete field on the Procore web application?,1309,https://support.procore.com/faq/can-i-update-the-percent-complete-field-on-the-web-application,84543,"Fri, 05 Jun 2020 14:10:21 GMT"
How does the Integration by Ryvit connect Procore with Viewpoint® Vista™?,1308,https://support.procore.com/faq/how-does-the-integration-by-ryvit-connect-procore-with-viewpoint-vista,24004,"Fri, 08 Sep 2017 17:42:47 GMT"
How do I change the 'Responsible Contractor' field on a submittal?,1304,https://support.procore.com/faq/how-do-i-change-the-responsible-contractor-field-on-my-submittal,3055,"Wed, 03 Jun 2015 16:14:04 GMT"
How does Procore calculate the 'Current Payment Due' amount on an invoice?,1288,https://support.procore.com/faq/how-does-procore-calculate-the-current-payment-due-amount-on-an-invoice,59906,"Fri, 11 Oct 2019 22:24:52 GMT"
Why isn't the 'Job to Date Costs' column in the budget matching our subcontractor invoice amounts?,1283,https://support.procore.com/faq/why-isnt-the-job-to-date-costs-column-in-the-budget-matching-our-subcontractor-invoice-amounts,24023,"Sat, 09 Sep 2017 00:41:45 GMT"
What is the new report index page?,1283,https://support.procore.com/faq/what-is-the-new-report-index-page,28486,"Mon, 29 Jan 2018 21:13:55 GMT"
Does Procore Sync work with my network drive?,1276,https://support.procore.com/faq/does-procore-drive-work-with-my-network-drive,21132,"Tue, 27 Jun 2017 23:14:54 GMT"
What data is synced between Sage 300 CRE® and Procore?,1263,https://support.procore.com/faq/what-data-is-synced-between-sage-300-cre-and-procore,1345,"Wed, 18 Feb 2015 20:06:27 GMT"
What do the punch item color codes on a drawing mean?,1258,https://support.procore.com/faq/what-do-the-punch-item-color-codes-on-a-drawing-mean,53039,"Mon, 24 Jun 2019 17:19:23 GMT"
What data is synced with the Integration by Ryvit connector?,1251,https://support.procore.com/faq/what-data-is-synced-with-the-integration-by-ryvit-connector,23637,"Mon, 28 Aug 2017 16:21:27 GMT"
How can I use the '[OAC Management Inc.] Pre-Drywall Checklist' inspection template on my project?,1251,https://support.procore.com/faq/how-can-i-use-the-oac-management-inc-pre-drywall-checklist-inspection-template-on-my-project,75951,"Thu, 02 Apr 2020 04:15:35 GMT"
What types of correspondences can be created with the Correspondence tool?,1248,https://support.procore.com/faq/what-types-of-correspondences-can-be-created-with-the-correspondence-tool,74837,"Fri, 20 Mar 2020 19:49:05 GMT"
Can I fill out forms on the web version of Procore?,1237,https://support.procore.com/faq/can-i-fill-out-forms-on-the-web-version-of-procore,24108,"Thu, 14 Sep 2017 17:38:45 GMT"
What file types and formats are supported in the attachment viewer in the Submittals tool?,1229,https://support.procore.com/faq/what-file-types-and-formats-are-supported-in-the-attachment-viewer-in-the-submittals-tool,140830,"Thu, 16 Sep 2021 19:49:44 GMT"
How do I filter items by multi-tiered locations?,1193,https://support.procore.com/faq/how-do-i-filter-items-by-multi-tiered-locations,4517,"Thu, 15 Oct 2015 20:19:24 GMT"
Are accounting approvers notified when data is awaiting acceptance in the ERP Integrations tool?,1180,https://support.procore.com/faq/are-accounting-approvers-notified-when-data-is-awaiting-acceptance-in-the-erp-integrations-tool,1325,"Wed, 18 Feb 2015 19:35:43 GMT"
"How are commitments, contracts, fundings, and changes numbered in Procore?",1176,https://support.procore.com/faq/how-are-commitments-contracts-fundings-and-changes-numbered-in-procore,63397,"Thu, 21 Nov 2019 16:25:48 GMT"
"What is the difference between a catalog, category, and item in the Cost Catalog for Estimating?",1175,https://support.procore.com/faq/what-is-the-difference-between-a-catalog-category-and-item-in-the-cost-catalog-for-estimating,133097,"Mon, 28 Jun 2021 18:56:33 GMT"
What custom segments should we create for our company's Work Breakdown Structure?,1169,https://support.procore.com/faq/what-custom-segments-should-we-create-for-our-companys-work-breakdown-structure,152113,"Tue, 08 Feb 2022 22:59:32 GMT"
How do I add the 'Timesheet Hours' column to a budget view?,1157,https://support.procore.com/faq/how-do-i-add-the-timesheet-hours-column-to-a-budget-view,72059,"Fri, 28 Feb 2020 20:12:06 GMT"
What is the difference between 'Field Productivity' and 'Workforce Management'?,1147,https://support.procore.com/faq/what-is-the-difference-between-field-productivity-and-workforce-management,57007,"Wed, 28 Aug 2019 23:23:52 GMT"
What are App Management Metrics and how do I access them?,1138,https://support.procore.com/faq/app-management-metrics-how-to-access,99258,"Tue, 22 Sep 2020 22:21:54 GMT"
What are the default statuses for change orders in Procore?,1129,https://support.procore.com/faq/what-are-the-default-statuses-for-change-orders-in-procore,124081,"Tue, 30 Mar 2021 15:43:03 GMT"
At what tier can an upstream collaborator approve a change order?,1124,https://support.procore.com/faq/at-what-tier-can-an-upstream-collaborator-approve-a-change-order,2856,"Wed, 20 May 2015 20:41:01 GMT"
Why am I receiving Procore emails at night?,1119,https://support.procore.com/faq/why-am-i-receiving-procore-emails-at-night,11637,"Thu, 03 Nov 2016 18:21:08 GMT"
How do I add a new Sage 300 CRE cost code or cost type?,1113,https://support.procore.com/faq/how-do-i-add-a-new-sage-300-cre-cost-code-or-cost-type,1334,"Wed, 18 Feb 2015 19:46:35 GMT"
Can I watch Procore Certification and Continuing Education courses from my mobile device?,1101,https://support.procore.com/faq/can-i-watch-procore-certification-and-continuing-education-courses-from-my-mobile-device,11692,"Thu, 03 Nov 2016 20:59:13 GMT"
What are the default statuses for insurance in Procore?,1094,https://support.procore.com/faq/what-are-the-default-statuses-for-insurance-in-procore,27154,"Tue, 12 Dec 2017 18:20:56 GMT"
What is in the emails sent from Procore?,1087,https://support.procore.com/faq/what-is-in-the-emails-sent-from-procore,2667,"Tue, 12 May 2015 16:58:35 GMT"
Why can't I create WBS custom segments?,1077,https://support.procore.com/faq/why-cant-i-create-wbs-custom-segments,153593,"Mon, 28 Feb 2022 19:35:40 GMT"
Can I upload drawings with the same revision?,1070,https://support.procore.com/faq/can-i-upload-drawings-with-the-same-revision,57522,"Fri, 06 Sep 2019 22:59:40 GMT"
Can I limit the number of cost codes available to choose from when creating timesheet entries?,1069,https://support.procore.com/faq/can-i-limit-the-number-of-cost-codes-available-to-choose-from-when-creating-timesheet-entries,28137,"Tue, 16 Jan 2018 18:56:57 GMT"
What is the maximum character length for a commitment's 'Title'?,1060,https://support.procore.com/faq/what-is-the-maximum-character-length-for-a-commitment-title,15514,"Tue, 14 Mar 2017 16:04:15 GMT"
"Which fields in the Submittals tool can be configured as required, optional, or hidden?",1056,https://support.procore.com/faq/which-fields-in-the-submittals-tool-can-be-configured-as-required-optional-or-hidden,72370,"Tue, 03 Mar 2020 02:58:31 GMT"
When does Procore send email notifications to invoice contacts?,1046,https://support.procore.com/faq/when-does-procore-send-email-notifications-to-invoice-contacts,110056,"Wed, 02 Dec 2020 16:07:15 GMT"
How do I give users access to the Prequalifications tool?,1041,https://support.procore.com/faq/how-do-i-give-users-access-to-the-prequalifications-tool,59825,"Wed, 09 Oct 2019 21:25:42 GMT"
Can I access Forms offline?,1038,https://support.procore.com/faq/can-i-access-forms-offline,24339,"Wed, 20 Sep 2017 21:34:40 GMT"
Which SSO identity providers are supported by Procore?,1032,https://support.procore.com/faq/which-sso-identity-providers-are-supported-by-procore,11312,"Wed, 26 Oct 2016 16:33:13 GMT"
Why are my change order's line items being duplicated on my owner's invoice?,1026,https://support.procore.com/faq/why-are-my-change-order-line-items-duplicated-on-my-owner-invoice,42563,"Tue, 27 Nov 2018 19:25:28 GMT"
Can I send a bid update email to every vendor/subcontractor?,1015,https://support.procore.com/faq/can-i-send-a-bid-update-email-to-every-vendor-subcontractor,955,"Mon, 02 Feb 2015 22:59:40 GMT"
"Why was the ""Procore Fundamentals"" training course deprecated?",1003,https://support.procore.com/faq/why-was-the-procore-fundamentals-training-course-deprecated,34848,"Mon, 11 Jun 2018 15:57:52 GMT"
How do I set up a budget view for real-time labor productivity?,1001,https://support.procore.com/faq/how-do-i-set-up-a-budget-view-for-real-time-labor-productivity,71204,"Fri, 21 Feb 2020 20:43:19 GMT"
What is Procore's availability?,995,https://support.procore.com/faq/what-is-procores-availability,2301,"Fri, 03 Apr 2015 19:53:12 GMT"
How do I stop a meeting item from carrying over to a follow-up meeting?,980,https://support.procore.com/faq/how-do-i-stop-a-meeting-item-from-carrying-over-to-a-follow-up-meeting,1521,"Mon, 23 Feb 2015 23:15:07 GMT"
What are the default statuses for change events in Procore?,972,https://support.procore.com/faq/what-are-the-default-statuses-for-change-events-in-procore,125361,"Tue, 20 Apr 2021 18:42:21 GMT"
How do I export cost forecast data from a Procore budget to Sage 300 CRE?,961,https://support.procore.com/faq/how-do-i-export-cost-forecast-data-from-a-procore-budget-to-sage-300-cre,71502,"Tue, 25 Feb 2020 19:10:10 GMT"
"Which fields in the Directory tool can be configured as required, optional, or hidden?",957,https://support.procore.com/faq/which-fields-in-the-directory-tool-can-be-configured-as-required-optional-or-hidden,55289,"Mon, 29 Jul 2019 18:16:55 GMT"
Why isn't my model showing when viewing models in Procore?,955,https://support.procore.com/faq/why-isnt-my-model-showing-when-viewing-models-in-procore,57673,"Wed, 11 Sep 2019 20:56:59 GMT"
Why do I see an error when trying to export data to Sage 300 CRE?,952,https://support.procore.com/faq/why-do-i-see-an-error-when-trying-to-export-data-to-sage-300-cre,1314,"Wed, 18 Feb 2015 17:40:19 GMT"
How can I determine the order in which change orders were approved?,950,https://support.procore.com/faq/how-can-i-determine-the-order-in-which-change-orders-were-approved,2197,"Tue, 24 Mar 2015 17:46:01 GMT"
Can I integrate my LMS with Procore Certification?,949,https://support.procore.com/faq/can-i-integrate-my-lms-with-procore-certification,11768,"Wed, 09 Nov 2016 18:41:59 GMT"
What options do I have for numbering RFIs in Procore?,943,https://support.procore.com/faq/what-options-do-i-have-for-numbering-rfis-in-procore,16728,"Wed, 19 Apr 2017 20:12:31 GMT"
"Which fields in the RFIs tool can be configured as required, optional, or hidden?",939,https://support.procore.com/faq/which-fields-in-the-rfis-tool-can-be-configured-as-required-optional-or-hidden,51355,"Thu, 23 May 2019 17:49:56 GMT"
How do I add an avatar or profile photo to Procore?,937,https://support.procore.com/faq/how-do-i-add-an-avatar-or-profile-photo-to-procore,1993,"Tue, 10 Mar 2015 15:45:07 GMT"
Why can't I delete items in Procore?,932,https://support.procore.com/faq/why-cant-i-delete-items-in-procore,31670,"Tue, 03 Apr 2018 16:45:45 GMT"
How can I keep track of emailed drawings?,913,https://support.procore.com/faq/how-can-i-keep-track-of-emailed-drawings,2779,"Mon, 18 May 2015 16:44:48 GMT"
Can I edit or delete a commitment after its been synced with an integrated ERP system?,900,https://support.procore.com/faq/can-i-edit-or-delete-a-commitment-after-its-been-synced-with-an-erp-integration,4909,"Thu, 10 Dec 2015 23:00:21 GMT"
Why is the delete button dimmed and not available in the Schedule tool of Procore Drive?,893,https://support.procore.com/faq/why-is-the-delete-button-dimmed-and-not-available--in-the-schedule-tool-of-procore-drive,2614,"Thu, 07 May 2015 23:21:01 GMT"
Why can't I create a change order?,887,https://support.procore.com/faq/why-cant-i-create-a-change-order,2243,"Mon, 30 Mar 2015 18:43:41 GMT"
What is Asta Powerproject and how does it integrate with Procore?,879,https://support.procore.com/faq/what-is-asta-powerproject-and-how-does-it-integrate-with-procore,12168,"Wed, 07 Dec 2016 19:01:42 GMT"
Why is the percentage complete less than 100% for a Procore Certification course?,877,https://support.procore.com/faq/why-is-the-percentage-complete-less-than-100-for-a-procore-certification-course,11201,"Mon, 17 Oct 2016 07:11:45 GMT"
How do I display a list of project dates on the Home page?,875,https://support.procore.com/faq/how-do-i-display-a-list-of-project-dates-on-the-home-page,15264,"Wed, 01 Mar 2017 23:11:38 GMT"
What is the Financials Dashboard?,867,https://support.procore.com/faq/what-is-the-financials-dashboard,21728,"Tue, 18 Jul 2017 17:40:35 GMT"
How can I use Procore's Incidents tool to record Coronavirus (COVID-19) infection information?,866,https://support.procore.com/faq/how-can-i-use-procores-incidents-tool-to-record-coronavirus-covid-19-infection-information,74688,"Fri, 20 Mar 2020 00:29:06 GMT"
Why do I need to log in to Procore's Support site?,861,https://support.procore.com/faq/why-do-i-need-to-log-in-to-procores-support-site,19902,"Wed, 14 Jun 2017 23:38:22 GMT"
What are the threshold values for the Portfolio tool's Health Dashboard?,855,https://support.procore.com/faq/what-are-the-threshold-values-for-the-portfolio-tools-health-dashboard,42891,"Fri, 30 Nov 2018 22:59:25 GMT"
"Which fields in the Observations tool can be configured as required, optional, or hidden?",852,https://support.procore.com/faq/which-fields-in-the-observations-tool-can-be-configured-as-required-optional-or-hidden,53358,"Thu, 27 Jun 2019 16:48:48 GMT"
"Which fields in the Inspections tool can be configured as required, optional, or hidden?",848,https://support.procore.com/faq/which-fields-in-the-inspections-tool-can-be-configured-as-required-optional-or-hidden,69908,"Tue, 11 Feb 2020 20:50:21 GMT"
What is Project Cost Reporting in Portfolio Financials?,847,https://support.procore.com/faq/what-is-project-cost-reporting-in-portfolio-financials,100878,"Mon, 28 Sep 2020 21:27:21 GMT"
How are the date columns in submittal custom reports calculated?,839,https://support.procore.com/faq/how-are-the-date-columns-in-submittal-custom-reports-calculated,35810,"Tue, 10 Jul 2018 18:51:56 GMT"
Can I export a Lookahead schedule?,839,https://support.procore.com/faq/can-i-export-a-lookahead-schedule,91579,"Tue, 28 Jul 2020 21:38:34 GMT"
How often can I sync data between QuickBooks® and Procore?,838,https://support.procore.com/integrations/quickbooks/faq/how-often-can-i-sync-data-between-quickbooks-and-procore,8036,"Tue, 31 May 2016 17:59:37 GMT"
Which Asta Powerproject file formats are supported by Procore?,835,https://support.procore.com/faq/which-asta-powerproject-file-formats-are-supported-by-procore,12170,"Wed, 07 Dec 2016 19:18:58 GMT"
Can I copy files in the Documents tool to another project?,828,https://support.procore.com/faq/can-i-copy-files-in-the-documents-tool-to-another-project,141319,"Thu, 23 Sep 2021 22:16:06 GMT"
How do I access an RFI as an assignee?,823,https://support.procore.com/faq/how-do-i-access-an-rfi-as-an-assignee,34212,"Thu, 24 May 2018 18:07:37 GMT"
"Why were the ""Deep-Dive Training"" courses deprecated?",820,https://support.procore.com/faq/why-were-the-deep-dive-training-courses-deprecated,34783,"Thu, 07 Jun 2018 18:48:44 GMT"
Can I fill out a form on my mobile device?,818,https://support.procore.com/faq/can-i-fill-out-a-form-on-my-mobile-device,24105,"Thu, 14 Sep 2017 17:31:37 GMT"
How do I configure user permissions for multi-tier approvals with timekeeping?,810,https://support.procore.com/faq/how-do-i-configure-user-permissions-for-multi-tier-approvals-with-timekeeping,116755,"Fri, 29 Jan 2021 15:33:16 GMT"
Can I mark all photos 'Private' in the project's Photos tool?,808,https://support.procore.com/faq/can-i-mark-all-photos-private-in-the-projects-photos-tool,1625,"Thu, 26 Feb 2015 17:51:38 GMT"
How do I add tools to my Favorites list in Procore?,804,https://support.procore.com/faq/how-do-i-add-tools-to-my-favorites-list-in-procore,22022,"Mon, 24 Jul 2017 18:03:07 GMT"
What are the default action plan verification methods?,801,https://support.procore.com/faq/what-are-the-default-action-plan-verification-methods,113175,"Mon, 04 Jan 2021 21:23:47 GMT"
How do I control which emails are sent by Procore from the Punch List tool?,797,https://support.procore.com/faq/how-do-i-control-which-emails-are-sent-by-procore-from-the-punch-list-tool,47406,"Tue, 26 Feb 2019 18:30:03 GMT"
What is the maximum character length for a commitment's 'Number (#)'?,796,https://support.procore.com/faq/what-is-the-maximum-character-length-for-a-commitments-number,26003,"Mon, 06 Nov 2017 17:53:49 GMT"
Can I rearrange the order of daily log sections?,793,https://support.procore.com/faq/can-i-rearrange-the-order-of-daily-log-sections,1561,"Tue, 24 Feb 2015 19:43:57 GMT"
What happens when I share a report with another Procore user?,792,https://support.procore.com/faq/what-happens-when-i-share-a-report-with-another-user,48288,"Thu, 14 Mar 2019 22:01:06 GMT"
Which project tools support Procore Search?,790,https://support.procore.com/faq/which-project-tools-support-procore-search,71579,"Tue, 25 Feb 2020 23:43:17 GMT"
Are commitments private by default?,787,https://support.procore.com/faq/are-commitments-private-by-default,1944,"Mon, 09 Mar 2015 18:42:22 GMT"
Why can't I update my Procore App? (iOS),785,https://support.procore.com/faq/why-cant-i-update-my-procore-app-ios,34289,"Tue, 29 May 2018 16:20:47 GMT"
What are 'Available Regions' on Marketplace Apps?,783,https://support.procore.com/faq/what-are-available-regions-on-apps,144040,"Wed, 27 Oct 2021 17:31:56 GMT"
Which insurance fields in a Procore company sync with Sage 300 CRE vendors?,781,https://support.procore.com/faq/which-insurance-fields-in-a-procore-company-sync-with-sage-300-cre,18957,"Tue, 30 May 2017 20:29:42 GMT"
How do I access my company's Training Center?,776,https://support.procore.com/faq/how-do-i-access-my-companys-training-center,70191,"Thu, 13 Feb 2020 00:13:00 GMT"
What is the difference between a labor productivity budget view and field production report?,776,https://support.procore.com/faq/what-is-the-difference-between-a-labor-productivity-budget-view-and-field-production-report,71008,"Wed, 19 Feb 2020 21:57:43 GMT"
How do the Change Events tool's column display settings work?,767,https://support.procore.com/faq/how-do-the-change-event-tools-column-display-settings-work,71149,"Fri, 21 Feb 2020 04:16:39 GMT"
Does a user need to log in to Procore to respond to an RFI?,762,https://support.procore.com/faq/does-a-user-need-to-log-in-to-procore-to-respond-to-an-rfi,1987,"Mon, 09 Mar 2015 23:44:20 GMT"
How do I allow 'Standard' users to add to the Project Directory?,762,https://support.procore.com/faq/how-do-i-allow-standard-users-to-add-users-to-the-project-directory,4534,"Mon, 19 Oct 2015 23:30:47 GMT"
Why are the status icons for Procore Sync not showing?,761,https://support.procore.com/faq/why-are-the-status-icons-for-procore-sync-not-showing,56471,"Mon, 19 Aug 2019 21:40:28 GMT"
Which data columns are in a Field Production Report?,760,https://support.procore.com/faq/which-data-columns-are-in-a-field-production-report,90087,"Mon, 13 Jul 2020 20:52:45 GMT"
Common Questions about Apps and the Procore App Marketplace,751,https://support.procore.com/faq/common-questions-apps-and-marketplace,114444,"Fri, 15 Jan 2021 23:36:28 GMT"
"What is the ""File Rename Information"" file included with my extracted project data?",751,https://support.procore.com/faq/what-is-the-file-rename-information-file-included-with-my-extracted-project-data,48765,"Tue, 26 Mar 2019 21:53:51 GMT"
Why are my courses not showing up in my Procore Certification profile?,749,https://support.procore.com/faq/why-are-my-courses-not-showing-up-in-my-procore-certification-profile,8480,"Mon, 20 Jun 2016 14:24:57 GMT"
How do I add unit-based line item details in Procore's budget import template?,749,https://support.procore.com/faq/how-do-i-add-unit-based-line-item-details-in-the-budget-import-template,70996,"Wed, 19 Feb 2020 17:41:16 GMT"
How do I setup Procore safety essentials pack in my account?,742,https://support.procore.com/faq/how-do-i-setup-procore-safety-essentials-pack-in-my-account,110921,"Mon, 07 Dec 2020 20:27:59 GMT"
Can I use the Procore Extracts application on a Mac?,736,https://support.procore.com/faq/can-i-use-the-procore-extracts-application-on-a-mac,48863,"Wed, 27 Mar 2019 20:47:53 GMT"
How do cost types from Procore Estimating map to Procore's Budget tool?,723,https://support.procore.com/faq/how-do-cost-types-from-procore-estimating-map-to-procores-budget-tool,151659,"Fri, 04 Feb 2022 02:10:37 GMT"
What is a budget code structure in Procore's WBS?,722,https://support.procore.com/faq/what-is-a-budget-code-structure,128712,"Wed, 12 May 2021 20:17:30 GMT"
Why is my form template not loading?,718,https://support.procore.com/faq/why-is-my-form-template-not-loading,24124,"Thu, 14 Sep 2017 23:39:23 GMT"
Where do I put my bid documents in Procore?,703,https://support.procore.com/faq/where-do-i-put-my-bid-documents-in-procore,963,"Tue, 03 Feb 2015 00:06:38 GMT"
How do I delete line items in approved change orders?,702,https://support.procore.com/faq/how-do-i-delete-line-items-in-approved-change-orders,3340,"Wed, 17 Jun 2015 21:20:51 GMT"
How is security handled with third-party applications?,702,https://support.procore.com/faq/how-is-security-handled-with-third-party-applications,80688,"Fri, 01 May 2020 14:51:06 GMT"
What is the difference between custom fields and configurable fieldsets?,700,https://support.procore.com/faq/what-is-the-difference-between-custom-fields-and-configurable-fieldsets,65780,"Mon, 16 Dec 2019 20:28:43 GMT"
