title,views,url,id,dateCreated
Why can't I log in to Procore?,590163,https://support.procore.com/faq/trouble-logging-in-to-procore,39950,"Thu, 11 Oct 2018 20:56:52 GMT"
How do I change my web browser's default email client for mailto links?,314789,https://support.procore.com/faq/how-do-i-change-my-web-browsers-default-email-client-for-mailto-links,4118,"Mon, 31 Aug 2015 18:30:51 GMT"
Why is my Procore Certified Certificate missing?,93348,https://support.procore.com/faq/why-is-my-procore-certified-certificate-missing,3297,"Tue, 16 Jun 2015 14:36:59 GMT"
What are Procore's default cost codes?,75230,https://support.procore.com/faq/what-are-procores-default-cost-codes,8087,"Mon, 06 Jun 2016 20:57:07 GMT"
What is the difference between SP- and IdP-Initiated SSO?,74367,https://support.procore.com/faq/what-is-the-difference-between-sp-and-idp-initiated-sso,15979,"Thu, 30 Mar 2017 15:18:29 GMT"
Why did I receive an error message in Procore?,73416,https://support.procore.com/faq/why-did-i-receive-an-error-message-in-procore,22721,"Fri, 04 Aug 2017 16:40:22 GMT"
How can I improve the accuracy of OCR on my drawings?,72026,https://support.procore.com/faq/how-can-i-improve-the-accuracy-of-ocr-on-my-drawings,5959,"Wed, 02 Mar 2016 22:52:05 GMT"
What is a submittal?,57007,https://support.procore.com/faq/what-is-a-submittal,1707,"Mon, 02 Mar 2015 17:12:24 GMT"
How do I navigate Procore's tools?,48413,https://support.procore.com/faq/how-do-i-navigate-procores-tools,1886,"Thu, 05 Mar 2015 22:43:41 GMT"
What is a Test Project?,35631,https://support.procore.com/faq/what-is-a-test-project,69126,"Fri, 31 Jan 2020 18:43:33 GMT"
What gets copied over to a new project when applying a project template?,34485,https://support.procore.com/faq/what-gets-copied-over-to-a-new-project-when-applying-a-project-template,2039,"Wed, 11 Mar 2015 16:14:54 GMT"
How do I reset an unknown password?,29250,https://support.procore.com/faq/how-do-i-reset-an-unknown-password,2843,"Tue, 19 May 2015 23:49:29 GMT"
Why are my drawing uploads failing?,29197,https://support.procore.com/faq/why-are-my-drawing-uploads-failing,44502,"Wed, 09 Jan 2019 00:20:33 GMT"
How do I add someone as an employee of my company?,28852,https://support.procore.com/faq/how-do-i-add-someone-as-an-employee-of-my-company,9338,"Thu, 21 Jul 2016 21:29:08 GMT"
What are the different change order tier settings in Project Financials?,27891,https://support.procore.com/faq/what-are-the-different-change-order-tier-settings-in-project-financials,2569,"Wed, 06 May 2015 22:42:37 GMT"
How can I improve the accuracy of Specification Section Identification?,26968,https://support.procore.com/faq/how-can-i-improve-the-accuracy-of-specification-section-identification,5950,"Wed, 02 Mar 2016 22:04:13 GMT"
How does the Transport Layer Security v1.2 requirement impact users?,22377,https://support.procore.com/faq/how-does-tls-1-2-impact-users,45562,"Fri, 25 Jan 2019 20:07:21 GMT"
What are the default project permissions templates in Procore?,19606,https://support.procore.com/faq/what-are-the-default-project-permissions-templates-in-procore,13775,"Fri, 20 Jan 2017 19:04:05 GMT"
Why can't I receive email from Procore?,19319,https://support.procore.com/faq/why-cant-i-receive-email-from-procore,1533,"Tue, 24 Feb 2015 00:32:27 GMT"
What is the difference between a distribution group and distribution list in Procore?,18726,https://support.procore.com/faq/what-is-the-difference-between-a-distribution-group-and-a-distribution-list,35893,"Thu, 12 Jul 2018 15:58:32 GMT"
Which domains do we add to our network's 'Allowed List' to ensure access to Procore?,18672,https://support.procore.com/faq/which-domains-do-we-add-to-our-networks-allowed-list-to-ensure-access-to-procore,32306,"Wed, 11 Apr 2018 17:32:17 GMT"
Why are my specification uploads failing?,17719,https://support.procore.com/faq/why-are-my-specification-uploads-failing,48646,"Mon, 25 Mar 2019 23:36:26 GMT"
How do I view incomplete certification or continuing education lessons?,17261,https://support.procore.com/faq/how-do-i-view-incomplete-certification-or-ce-lessons,22959,"Wed, 09 Aug 2017 16:45:20 GMT"
"What's the difference between a job, a parent job, and a sub job?",17224,https://support.procore.com/faq/what's-the-difference-between-a-job-a-parent-job-and-a-sub-job,21104,"Tue, 27 Jun 2017 17:55:19 GMT"
What is a Training Center?,17063,https://support.procore.com/faq/what-is-a-training-center,9235,"Tue, 12 Jul 2016 22:35:01 GMT"
What are the default submittal responses in Procore?,16390,https://support.procore.com/faq/what-are-the-default-submittal-responses-in-procore,13293,"Tue, 10 Jan 2017 21:04:13 GMT"
What type of mobile device should I use for Procore?,16358,https://support.procore.com/faq/what-type-of-mobile-device-should-i-use-for-procore,11316,"Wed, 26 Oct 2016 18:11:45 GMT"
What is a Project Template?,16289,https://support.procore.com/faq/what-is-a-project-template,69142,"Fri, 31 Jan 2020 23:07:23 GMT"
What are configurable fieldsets and which Procore tools support them?,15346,https://support.procore.com/faq/what-are-configurable-fieldsets-and-which-procore-tools-support-them,50762,"Wed, 08 May 2019 17:38:59 GMT"
What is 'Blocking Functionality' in an action plan?,14585,https://support.procore.com/faq/what-is-blocking-functionality-in-an-action-plan,106882,"Tue, 03 Nov 2020 00:34:34 GMT"
Which Procore tools support granular permissions?,14128,https://support.procore.com/faq/which-procore-tools-support-granular-permissions,14116,"Fri, 27 Jan 2017 19:57:53 GMT"
What is the Punch List Workflow?,13966,https://support.procore.com/faq/what-is-the-punch-list-work-flow,34937,"Wed, 13 Jun 2018 21:50:35 GMT"
What is a permissions template?,13841,https://support.procore.com/faq/what-is-a-permissions-template,13801,"Fri, 20 Jan 2017 23:59:26 GMT"
How do I create a fillable PDF?,13727,https://support.procore.com/faq/how-do-i-create-a-fillable-pdf,24236,"Tue, 19 Sep 2017 18:47:27 GMT"
How do I sign-up for Procore Certification if I do not have Procore login credentials?,13622,https://support.procore.com/faq/how-do-i-sign-up-for-procore-certification-if-i-do-not-have-procore-login-credentials,3634,"Mon, 13 Jul 2015 05:54:59 GMT"
Who Needs Continuing Education Units?,13498,https://support.procore.com/continuing-education/faq/who-needs-continuing-education-units,9414,"Thu, 28 Jul 2016 18:12:40 GMT"
What is an 'Instruction' or 'Site Instruction'?,13223,https://support.procore.com/faq/what-is-a-site-instruction,19227,"Mon, 05 Jun 2017 21:34:54 GMT"
What is the difference between raster and vector content in PDFs?,12484,https://support.procore.com/faq/what-is-the-difference-between-raster-and-vector-content-in-pdfs,21233,"Fri, 30 Jun 2017 22:35:56 GMT"
What is a change event?,11406,https://support.procore.com/faq/what-is-a-change-event,4670,"Wed, 04 Nov 2015 18:30:49 GMT"
(Legacy) How do I bill for stored materials in Procore?,11291,https://support.procore.com/faq/how-do-i-bill-for-stored-materials-in-procore,5842,"Thu, 25 Feb 2016 17:57:06 GMT"
Can I change a person's email address in the Directory?,11053,https://support.procore.com/faq/can-i-change-a-persons-email-address-in-the-directory,2835,"Tue, 19 May 2015 18:46:22 GMT"
What is the construction bidding process?,10425,https://support.procore.com/faq/what-is-the-construction-bidding-process,1858,"Thu, 05 Mar 2015 00:42:19 GMT"
What are Procore's default cost types?,10342,https://support.procore.com/faq/what-are-procores-default-cost-types,25204,"Fri, 13 Oct 2017 16:12:16 GMT"
What are the default permission levels in Procore?,10072,https://support.procore.com/faq/what-are-the-default-permission-levels-in-procore,9075,"Thu, 07 Jul 2016 16:56:06 GMT"
What is a submittal package?,9952,https://support.procore.com/faq/what-is-a-submittal-package,11030,"Mon, 10 Oct 2016 23:13:34 GMT"
What are Procore's Product Categories?,9947,https://support.procore.com/faq/what-are-procores-product-categories,56193,"Tue, 13 Aug 2019 16:32:55 GMT"
How do I sign up for Procore?,9793,https://support.procore.com/faq/how-do-i-sign-up-for-procore,2647,"Mon, 11 May 2015 21:32:16 GMT"
How do I prepare my data for import into Procore?,9782,https://support.procore.com/faq/how-do-i-prepare-my-data-for-import-into-procore,6300,"Thu, 10 Mar 2016 17:20:04 GMT"
How do I create a desktop shortcut to Procore?,9763,https://support.procore.com/faq/how-do-i-create-a-desktop-shortcut-to-procore,7627,"Tue, 03 May 2016 07:30:34 GMT"
What is a fillable PDF?,9546,https://support.procore.com/faq/what-is-a-fillable-pdf,24089,"Thu, 14 Sep 2017 16:16:40 GMT"
What are Drawing Areas?,9540,https://support.procore.com/faq/what-are-drawing-areas,4449,"Fri, 09 Oct 2015 20:34:23 GMT"
Why am I unable to download and open a .ZIP file from Procore?,9511,https://support.procore.com/faq/why-am-i-unable-to-download-and-open-a-zip-file-from-procore,870,"Fri, 30 Jan 2015 19:15:43 GMT"
How do I configure a prefix and starting number for a project's RFIs?,9276,https://support.procore.com/faq/how-do-i-configure-a-prefix-and-starting-number-for-a-projects-rfis,16435,"Wed, 12 Apr 2017 02:25:50 GMT"
Why are automatic drawing sheet links missing?,8805,https://support.procore.com/faq/why-are-automatic-drawing-sheet-links-missing,1035,"Wed, 04 Feb 2015 20:12:25 GMT"
How do I set the accounting method for a contract or funding?,8586,https://support.procore.com/faq/how-do-i-set-the-accounting-method-for-a-contract-or-funding,897,"Fri, 30 Jan 2015 23:29:18 GMT"
When does the Submittals tool send email notifications to Procore users?,8568,https://support.procore.com/faq/when-does-the-submittals-tool-send-email-notifications-to-procore-users,35845,"Wed, 11 Jul 2018 21:01:58 GMT"
What are custom fields and which Procore tools support them?,8493,https://support.procore.com/faq/what-are-custom-fields-and-which-procore-tools-support-them,63611,"Mon, 25 Nov 2019 20:26:17 GMT"
What is the maximum character length for a 'Company Name' in the Directory tool?,8480,https://support.procore.com/faq/what-is-the-maximum-character-length-for-a-company-name-in-the-directory-tool,29525,"Thu, 15 Feb 2018 20:50:06 GMT"
What is the 'Enable Always Editable Schedule of Values' setting?,8349,https://support.procore.com/faq/what-is-the-enable-always-editable-schedule-of-values-setting,139472,"Mon, 23 Aug 2021 22:10:33 GMT"
What is a 'contact' in Procore and which project tools support the concept?,8208,https://support.procore.com/faq/what-is-a-contact-in-procore-and-which-project-tools-support-the-concept,53078,"Mon, 24 Jun 2019 23:07:01 GMT"
How do I set up a project in Procore?,8199,https://support.procore.com/faq/how-do-i-set-up-a-project-in-procore,8112,"Tue, 07 Jun 2016 20:49:30 GMT"
What is a 'Draft' RFI?,8106,https://support.procore.com/faq/what-is-a-draft-rfi,1728,"Mon, 02 Mar 2015 23:36:37 GMT"
What is a daily log?,7998,https://support.procore.com/faq/what-is-a-daily-log,1855,"Thu, 05 Mar 2015 00:23:08 GMT"
What are the differences between Procore's time modules?,7955,https://support.procore.com/faq/what-are-the-differences-between-procores-time-modules,23726,"Wed, 30 Aug 2017 20:37:24 GMT"
Can I use Procore's mobile application in offline mode?,7910,https://support.procore.com/faq/can-i-use-procores-mobile-application-offline,4164,"Fri, 11 Sep 2015 23:54:00 GMT"
When does the RFIs tool send email notifications?,7798,https://support.procore.com/faq/when-does-the-rfis-tool-send-email-notifications,29112,"Thu, 08 Feb 2018 17:46:06 GMT"
What are dynamic approver due dates?,7766,https://support.procore.com/faq/what-are-dynamic-approver-due-dates,55522,"Thu, 01 Aug 2019 18:44:45 GMT"
What’s the difference between sequential and parallel approval in the submittal workflow?,7607,https://support.procore.com/faq/whats-the-difference-between-sequential-and-parallel-approval-in-the-submittal-workflow,3863,"Tue, 11 Aug 2015 23:27:28 GMT"
Who receives an email when a submittal is created or updated?,7485,https://support.procore.com/faq/who-receives-an-email-when-a-submittal-is-created-or-updated,945,"Mon, 02 Feb 2015 21:55:27 GMT"
What is blind bidding?,7461,https://support.procore.com/faq/what-is-blind-bidding,3406,"Mon, 22 Jun 2015 16:48:16 GMT"
"Which fields on the create or update project page can be configured as required, optional, or hidden?",7426,https://support.procore.com/faq/which-fields-on-the-create-or-update-project-page-can-be-configured-as-required-optional-or-hidden,66960,"Thu, 09 Jan 2020 16:32:31 GMT"
How can I use tax codes on a Procore project?,7330,https://support.procore.com/faq/how-can-i-use-tax-codes-on-a-procore-project,41377,"Fri, 09 Nov 2018 18:57:03 GMT"
Who receives a notification for updates in the Drawings tool?,7294,https://support.procore.com/faq/who-receives-a-notification-for-updates-in-the-drawings-tool,47821,"Wed, 06 Mar 2019 00:00:06 GMT"
What is the RFI Manager role?,7179,https://support.procore.com/faq/what-is-the-rfi-manager-role,14837,"Thu, 09 Feb 2017 17:04:56 GMT"
What are multi-tiered locations?,7177,https://support.procore.com/faq/what-are-multi-tiered-locations,4515,"Thu, 15 Oct 2015 17:03:12 GMT"
What is an assignable permissions template?,7096,https://support.procore.com/faq/what-is-an-assignable-permissions-template,19854,"Tue, 13 Jun 2017 16:40:19 GMT"
What is an RFI?,7033,https://support.procore.com/faq/what-is-an-rfi,1704,"Mon, 02 Mar 2015 17:03:30 GMT"
What does each permission level mean?,6863,https://support.procore.com/faq/what-does-each-permission-level-mean,2610,"Thu, 07 May 2015 21:44:54 GMT"
Why isn't my project weather working?,6849,https://support.procore.com/faq/why-isnt-my-project-weather-working,4513,"Thu, 15 Oct 2015 16:43:47 GMT"
What is the difference between personal and published drawing markups?,6822,https://support.procore.com/faq/what-is-the-difference-between-personal-and-published-drawing-markups,999,"Tue, 03 Feb 2015 18:53:05 GMT"
Why can't I create or activate Procore projects?,6722,https://support.procore.com/faq/why-cant-i-create-or-activate-procore-projects,19242,"Mon, 05 Jun 2017 23:37:06 GMT"
How do I invite users and collaborators to my company's Procore account?,6621,https://support.procore.com/faq/how-do-i-invite-users-and-collaborators-to-my-companys-procore-account,7266,"Wed, 13 Apr 2016 07:08:13 GMT"
How do I add a multi-tiered location to an item?,6597,https://support.procore.com/faq/how-do-i-add-a-multi-tiered-location-to-an-item,4509,"Wed, 14 Oct 2015 23:30:25 GMT"
What is the unpublished status on drawings?,6364,https://support.procore.com/faq/what-is-the-unpublished-status-on-drawings,22989,"Thu, 10 Aug 2017 22:14:43 GMT"
What is Single Sign-On (SSO)?,6334,https://support.procore.com/faq/what-is-single-sign-on-sso,5073,"Wed, 06 Jan 2016 00:46:30 GMT"
What are the DocuSign® fields and can I customize them?,6184,https://support.procore.com/faq/what-are-the-docusign-fields-and-can-i-customize-them,28372,"Thu, 25 Jan 2018 21:15:54 GMT"
Can I provide users with 'Read-Only' level permissions with limited access to update information in Procore?,6053,https://support.procore.com/faq/can-i-provide-users-with-read-only-level-permissions-with-limited-access-to-update-information-in-procore,22978,"Thu, 10 Aug 2017 17:47:05 GMT"
How do I manage the storage the Procore mobile app is using on my device?,5955,https://support.procore.com/faq/how-do-i-manage-the-storage-the-procore-mobile-app-is-using-on-my-device,7094,"Mon, 28 Mar 2016 20:34:24 GMT"
What is Bluebeam Studio?,5887,https://support.procore.com/faq/what-is-bluebeam-studio,15927,"Tue, 28 Mar 2017 23:26:50 GMT"
What is a submittal revision?,5827,https://support.procore.com/faq/what-is-a-submittal-revision,862,"Thu, 29 Jan 2015 23:26:47 GMT"
How are submittals numbered in Procore?,5782,https://support.procore.com/faq/how-are-submittals-numbered-in-procore,7612,"Mon, 02 May 2016 15:57:41 GMT"
Why am I receiving an error message in the Procore Imports app?,5709,https://support.procore.com/faq/why-am-i-receiving-an-error-message-in-the-procore-imports-app,35870,"Wed, 11 Jul 2018 22:43:29 GMT"
What is the 'Submittal Manager' role?,5692,https://support.procore.com/faq/what-is-the-submittal-manager-role,23444,"Wed, 23 Aug 2017 15:56:07 GMT"
Can I copy one project's Documents folders to a new project?,5662,https://support.procore.com/faq/can-i-copy-one-projects-folders-to-a-new-project,1872,"Thu, 05 Mar 2015 18:39:21 GMT"
How can I use the '[Procore] Jobsite Cleanliness and Preparedness Checklist' inspection template on my project?,5653,https://support.procore.com/faq/how-can-i-use-the-procore-jobsite-cleanliness-and-preparedness-checklist-inspection-template-on-my-project,75625,"Fri, 27 Mar 2020 00:35:44 GMT"
Why do I not have permission to view this web page?,5504,https://support.procore.com/faq/why-do-i-not-have-permission-to-view-this-web-page,19898,"Wed, 14 Jun 2017 23:12:19 GMT"
Where and how does Procore store customer information?,5489,https://support.procore.com/faq/where-and-how-does-procore-store-customer-information,2295,"Fri, 03 Apr 2015 19:45:08 GMT"
What are 'cost types' and how does our ERP integration support them?,5337,https://support.procore.com/faq/what-are-cost-types-and-how-does-our-erp-integration-support-them,13136,"Wed, 04 Jan 2017 22:53:08 GMT"
What is Procore BIM?,5287,https://support.procore.com/faq/what-is-procore-bim,54344,"Mon, 15 Jul 2019 18:10:26 GMT"
What are custom project roles?,5255,https://support.procore.com/faq/what-are-custom-project-roles,14931,"Mon, 13 Feb 2017 23:45:49 GMT"
Why are the weather conditions not showing on my Daily Log weather log?,5237,https://support.procore.com/faq/why-are-the-weather-conditions-not-showing-on-my-daily-log-weather-log,1562,"Tue, 24 Feb 2015 19:48:54 GMT"
What is a construction project's schedule?,5221,https://support.procore.com/faq/what-is-a-construction-projects-schedule,1865,"Thu, 05 Mar 2015 00:58:29 GMT"
What is Procore's Recycle Bin?,5213,https://support.procore.com/faq/what-is-procores-recycle-bin,810,"Wed, 28 Jan 2015 01:28:04 GMT"
How do I share feedback with Procore?,5119,https://support.procore.com/faq/how-do-i-share-feedback-with-procore,2638,"Mon, 11 May 2015 16:48:08 GMT"
Which budget views should I add to my Procore projects?,5118,https://support.procore.com/faq/which-budget-views-should-i-add-to-my-projects,16318,"Tue, 11 Apr 2017 20:59:49 GMT"
How do I change companies in Procore's navigation bar?,5111,https://support.procore.com/faq/how-do-i-change-companies-in-procores-navigation-bar,16111,"Tue, 04 Apr 2017 22:25:39 GMT"
How do I download Procore's iOS mobile application?,5072,https://support.procore.com/faq/how-do-i-download-the-procore-ios-mobile-application,4143,"Wed, 09 Sep 2015 20:18:11 GMT"
Why are my files not syncing with Procore Sync?,5047,https://support.procore.com/faq/why-are-my-files-not-syncing-with-procore-sync,21119,"Tue, 27 Jun 2017 22:29:52 GMT"
How do I add people to the submittal workflow?,4984,https://support.procore.com/faq/how-do-i-add-people-to-the-submittal-workflow,28118,"Tue, 16 Jan 2018 16:46:27 GMT"
Can I rotate a drawing in Procore?,4960,https://support.procore.com/faq/can-i-rotate-a-drawing-in-procore,5071,"Wed, 06 Jan 2016 00:33:10 GMT"
Who can view a 'Draft' RFI?,4930,https://support.procore.com/faq/who-can-view-a-draft-rfi,22955,"Wed, 09 Aug 2017 16:02:10 GMT"
What is a 'Draft' submittal?,4914,https://support.procore.com/faq/what-is-a-draft-submittal,32021,"Thu, 05 Apr 2018 21:27:28 GMT"
What are the blue icons in my drawings log?,4830,https://support.procore.com/faq/what-are-the-blue-icons-in-my-drawings-log,8858,"Tue, 28 Jun 2016 21:19:56 GMT"
How do I control which emails are sent by Procore during the RFI process?,4797,https://support.procore.com/faq/how-do-i-control-which-emails-are-sent-by-procore-during-the-rfi-process,1985,"Mon, 09 Mar 2015 23:38:10 GMT"
How do I build a Training Center?,4796,https://support.procore.com/faq/how-do-i-build-a-training-center,9246,"Wed, 13 Jul 2016 00:14:24 GMT"
What is App Management?,4739,https://support.procore.com/faq/what-is-app-management,58390,"Thu, 19 Sep 2019 15:57:28 GMT"
What is the accounting approver role?,4687,https://support.procore.com/faq/what-is-the-accounting-approver-role,9652,"Thu, 04 Aug 2016 21:34:54 GMT"
How does the Office 365 integration in Procore's Documents Tool work?,4684,https://support.procore.com/faq/how-does-the-office-365-integration-in-procores-documents-tool-work,68176,"Thu, 23 Jan 2020 17:56:15 GMT"
What is a change order?,4572,https://support.procore.com/faq/what-is-a-change-order,1861,"Thu, 05 Mar 2015 00:50:14 GMT"
Who receives notification emails when a vendor's insurance expires?,4564,https://support.procore.com/faq/who-receives-notification-emails-when-a-vendors-insurance-expires,57960,"Fri, 13 Sep 2019 20:58:13 GMT"
What is the Procore plugin and what is it used for?,4521,https://support.procore.com/faq/what-is-the-procore-plugin-and-what-is-it-used-for,49062,"Tue, 02 Apr 2019 16:59:09 GMT"
"Where can I find the email address to send daily logs, photos, documents, and emails to Procore?",4504,https://support.procore.com/faq/where-can-i-find-the-email-address-to-send-photos-documents-and-emails-to-procore,1537,"Tue, 24 Feb 2015 00:45:16 GMT"
How does Procore automatically complete amounts on an upstream invoice?,4477,https://support.procore.com/faq/how-does-procore-automatically-fill-in-amounts-on-an-upstream-invoice,49855,"Thu, 18 Apr 2019 21:20:36 GMT"
What is a system tray?,4453,https://support.procore.com/faq/what-is-a-system-tray,20219,"Mon, 19 Jun 2017 21:55:53 GMT"
How can I see where my non-budgeted line items are coming from?,4414,https://support.procore.com/faq/how-can-i-see-where-my-non-budgeted-line-items-are-coming-from,29841,"Fri, 23 Feb 2018 00:54:26 GMT"
Which weather providers are supported by Procore?,4348,https://support.procore.com/faq/which-weather-providers-are-supported-by-procore,23387,"Mon, 21 Aug 2017 23:42:15 GMT"
Are there any system limitations when projects have multiple prime contracts?,4334,https://support.procore.com/faq/are-there-any-system-limitations-when-creating-multiple-prime-contracts,39829,"Mon, 08 Oct 2018 22:41:38 GMT"
What are the default observation types used for?,4332,https://support.procore.com/faq/what-are-the-default-observation-types-used-for,5628,"Wed, 10 Feb 2016 22:50:33 GMT"
"What are ""related items"" in Procore?",4309,https://support.procore.com/faq/what-are-related-items-in-procore,3318,"Tue, 16 Jun 2015 21:06:45 GMT"
How do I find the project ID?,4252,https://support.procore.com/faq/how-do-i-find-the-project-id,4109,"Tue, 25 Aug 2015 22:43:48 GMT"
What is a specification set?,4171,https://support.procore.com/faq/what-is-a-specification-set,4481,"Mon, 12 Oct 2015 18:24:28 GMT"
Does an invoice contact need an 'Invite to Bill' to submit an invoice?,4159,https://support.procore.com/faq/does-an-invoice-contact-need-an-invite-to-bill-to-submit-an-invoice,13068,"Tue, 03 Jan 2017 18:36:17 GMT"
What is a Drawing Set?,4128,https://support.procore.com/faq/what-is-a-drawing-set,993,"Tue, 03 Feb 2015 18:21:38 GMT"
Why is the Financial Health section of the Health Dashboard not configured?,4087,https://support.procore.com/faq/why-is-my-financial-health-section-of-the-health-dashboard-not-configured,43235,"Thu, 06 Dec 2018 22:49:46 GMT"
Which web browsers are supported by Procore?,4013,https://support.procore.com/faq/which-web-browsers-are-supported-by-procore,1956,"Mon, 09 Mar 2015 19:19:11 GMT"
What is the Budget Forecast Report?,3996,https://support.procore.com/faq/how-does-the-budget-forecast-report,1874,"Thu, 05 Mar 2015 19:06:36 GMT"
Why am I unable to log in to the Procore Certification site?,3929,https://support.procore.com/faq/why-am-i-unable-to-log-in-to-the-procore-certification-site,11734,"Mon, 07 Nov 2016 23:44:53 GMT"
Why are some files missing after downloading from Procore Sync?,3886,https://support.procore.com/faq/why-are-some-files-missing-after-downloading-from-procore-sync,29612,"Fri, 16 Feb 2018 22:09:27 GMT"
How do I enable the DocuSign® Integration?,3862,https://support.procore.com/faq/how-do-i-enable-the-docusign-integration,17823,"Thu, 11 May 2017 21:24:10 GMT"
"Can I change the language of my Company, Project, or User in Procore?",3719,https://support.procore.com/faq/can-i-change-the-language-of-my-company-project-or-user-in-procore,37221,"Fri, 10 Aug 2018 17:20:25 GMT"
How do I preserve cost code formatting in Excel?,3670,https://support.procore.com/faq/how-do-i-preserve-cost-code-formatting-in-excel,5813,"Wed, 24 Feb 2016 18:02:53 GMT"
How can I use Procore's Toolbox Talk Sign-In PDF in my project's Forms tool?,3641,https://support.procore.com/faq/how-can-i-use-procores-toolbox-talk-sign-in-pdf-in-my-projects-forms-tool,82002,"Wed, 13 May 2020 19:43:22 GMT"
Which fields can Procore automatically populate when uploading drawings?,3593,https://support.procore.com/faq/which-fields-can-procore-automatically-populate-when-uploading-drawings,997,"Tue, 03 Feb 2015 18:42:09 GMT"
What is a Service Account?,3551,https://support.procore.com/faq/what-is-a-service-account,108727,"Tue, 17 Nov 2020 00:13:51 GMT"
Is there a minimum passing score for Procore Certification quizzes?,3519,https://support.procore.com/faq/is-there-a-minimum-passing-score-for-procore-certification-quizzes,11304,"Tue, 25 Oct 2016 20:58:02 GMT"
Who can be designated as an 'Assignee' on an RFI?,3512,https://support.procore.com/faq/who-can-be-designated-as-an-assignee-on-an-rfi,32435,"Fri, 13 Apr 2018 21:54:03 GMT"
What is an invoice contact?,3474,https://support.procore.com/faq/what-is-an-invoice-contact,89635,"Wed, 08 Jul 2020 22:25:12 GMT"
Can I include signature fields in my fillable PDFs?,3473,https://support.procore.com/faq/can-i-include-signature-fields-in-my-fillable-pdfs,27115,"Fri, 08 Dec 2017 23:23:00 GMT"
How do I download Procore's Android mobile application?,3427,https://support.procore.com/faq/how-do-i-download-the-procore-android-mobile-application,4193,"Fri, 18 Sep 2015 16:54:13 GMT"
